761,sit amet cursus id turpis integer aliquet massa,009 Lien Point,Ishim,1941,10,120571,2020-10-24 07:10:31
762,venenatis tristique fusce congue,62639 Oxford Center,Mokolo,312,5,581244,2020-06-11 08:14:47
763,proin interdum mauris non,2 Summer Ridge Court,Jablonec nad Nisou,826,3,185069,2020-12-08 15:50:20
764,ac enim in tempor turpis nec,6511 East Circle,Pregrada,273,5,39587,2021-01-03 05:16:13
765,a pede posuere,89087 Carioca Drive,Pangligaran,1125,4,529785,2021-02-16 01:50:07
766,duis bibendum felis sed interdum,44 Hoffman Drive,Ciechocin,932,2,42106,2021-03-08 15:26:07
767,est congue elementum in hac habitasse platea dictumst,18 Dapin Court,Morawica,1173,4,660673,2020-08-08 22:37:22
768,enim lorem ipsum dolor sit amet,65 Shopko Street,Hele,1475,6,313019,2020-10-19 03:45:06
769,dignissim vestibulum vestibulum ante ipsum primis in,4374 Hallows Avenue,Chegutu,276,3,73639,2020-09-30 20:18:04
770,feugiat non pretium quis,37 3rd Avenue,Moste,1763,6,511072,2020-05-19 08:11:24
771,est risus auctor sed tristique in tempus sit,5256 Linden Trail,Kotikawatta,857,3,807242,2020-08-29 19:59:15
772,blandit lacinia erat vestibulum,3 Novick Court,Anjani Barat,1823,10,665132,2020-10-03 05:47:53
773,amet justo morbi,49 Lakewood Parkway,Guacarí,1115,4,146522,2020-10-24 06:10:08
774,sed accumsan felis ut at dolor quis odio,9 Bultman Alley,Bogolyubovo,410,4,699625,2021-04-20 15:19:09
775,tincidunt eu felis fusce posuere,384 Claremont Point,Huajie,1026,3,510147,2021-01-03 15:26:17
776,porta volutpat quam pede,7107 Algoma Trail,Holýšov,1368,4,190534,2020-10-16 16:56:08
777,risus praesent lectus vestibulum quam sapien varius,310 Cordelia Terrace,Araguaiana,273,6,777188,2021-01-18 20:16:03
778,id sapien in sapien,04 Forest Road,Vahdat,258,10,232583,2021-04-19 07:39:40
779,nisl aenean lectus pellentesque eget,8092 Merrick Road,Västerås,1650,6,184335,2020-08-25 19:36:19
780,id ligula suspendisse ornare consequat lectus in est,025 Dahle Road,Daping,241,2,631068,2021-03-06 03:19:20
781,integer non velit donec diam neque vestibulum,22927 Browning Road,Taldykorgan,1801,7,352369,2021-01-21 14:18:15
782,nulla facilisi cras non velit nec nisi,70 Ohio Avenue,Skatepark,935,7,490100,2021-01-16 02:05:18
783,luctus et ultrices posuere cubilia,6 Dawn Trail,Yidu,1853,9,423558,2020-11-01 08:15:12
784,quis libero nullam sit amet turpis elementum,8408 Armistice Place,Hongtang,1368,1,526700,2020-07-10 16:10:14
785,in faucibus orci luctus et,614 Buell Crossing,Trelew,1593,4,799103,2021-02-10 20:38:02
786,ac leo pellentesque,98952 John Wall Point,Ibarra,1476,9,337677,2021-04-16 13:09:27
787,sapien cum sociis,700 Forest Crossing,Zhongbu,1477,1,855171,2020-07-01 08:24:19
788,suspendisse potenti in,9351 Parkside Court,Korsze,1694,8,751221,2020-10-23 12:22:37
789,orci luctus et ultrices posuere cubilia curae donec,8055 Pond Junction,Oslo,309,2,446622,2020-12-11 22:26:57
790,eget eleifend luctus ultricies,44018 Burning Wood Alley,Zhaxirabdain,1525,3,707210,2021-02-12 07:15:20
791,aliquet maecenas leo odio condimentum id luctus nec,05 Independence Drive,Gornje Živinice,288,5,634766,2020-05-31 01:34:47
792,mus vivamus vestibulum sagittis,95173 Golf Course Drive,Foundiougne,1723,2,311113,2020-06-25 02:37:17
793,ultrices posuere cubilia,246 Elka Plaza,Vergara,27,7,527344,2020-10-11 07:33:53
794,eleifend pede libero quis orci nullam molestie,3123 Norway Maple Plaza,Calvário,1919,3,441338,2021-05-06 18:49:59
795,non interdum in ante vestibulum,310 Spohn Parkway,Camasca,1706,2,496757,2021-01-20 08:11:21
796,sem sed sagittis nam congue,8840 Commercial Lane,Portland,1732,10,965399,2021-02-05 14:13:10
797,elit sodales scelerisque mauris sit amet eros,9 Sachtjen Parkway,Chambishi,1977,8,399295,2020-12-03 23:21:09
798,nunc purus phasellus in felis donec semper sapien,2956 Logan Place,Areado,1577,5,515498,2020-05-24 16:30:24
799,vel dapibus at diam nam,14442 Main Parkway,Klampok,1592,6,188538,2020-06-16 06:23:33
800,nunc commodo placerat praesent blandit nam nulla integer,889 Oakridge Drive,Ban Selaphum,1496,10,36142,2020-11-20 21:18:42
801,congue eget semper,598 Esch Circle,Baziqiao,511,9,167898,2020-10-02 14:18:56
802,nullam sit amet,670 Maywood Terrace,Khakhea,400,9,243699,2020-06-20 10:35:38
803,tempor turpis nec euismod scelerisque,25 5th Place,Sipirok,502,4,641362,2020-06-18 10:32:38
804,sed vestibulum sit amet cursus id turpis integer,93939 Carioca Court,Obolensk,104,4,892086,2021-05-23 23:42:52
805,consectetuer eget rutrum at lorem,3898 Haas Place,Tambong,215,2,642085,2021-05-19 20:34:24
806,euismod scelerisque quam turpis adipiscing lorem vitae,0404 Eggendart Way,Arras,1203,8,154774,2020-09-03 14:12:23
807,leo pellentesque ultrices mattis odio donec vitae nisi,93 Riverside Plaza,Istres,797,8,338585,2020-06-16 06:34:54
808,in magna bibendum,48079 Express Place,Pare,1327,5,643834,2020-05-28 20:35:40
809,tincidunt ante vel ipsum praesent blandit lacinia,458 Little Fleur Terrace,Yamaga,105,4,11129,2020-12-28 23:12:54
810,id ligula suspendisse ornare consequat lectus in,9 Anthes Pass,Umuquena,157,3,828337,2020-09-28 10:18:29
811,congue eget semper rutrum nulla nunc purus phasellus,66020 Myrtle Street,Bom Despacho,501,2,159156,2020-12-06 05:02:59
812,nunc rhoncus dui vel,4 Pepper Wood Court,Baugo,1577,8,880815,2021-03-20 00:05:10
813,vulputate justo in blandit ultrices enim lorem,091 Ohio Place,Tirah,206,2,451768,2021-01-08 07:37:57
814,ultrices posuere cubilia curae,3 Delladonna Terrace,Bograd,1880,3,469412,2020-10-14 02:26:45
815,elit ac nulla sed vel enim sit amet,93341 Westerfield Drive,Sîr ed Danniyé,706,8,722391,2021-01-19 23:10:39
816,sollicitudin vitae consectetuer eget rutrum at lorem integer,7 Holy Cross Parkway,Tabinay,81,4,374737,2021-03-13 08:25:38
817,elit ac nulla sed vel enim,55289 Waxwing Drive,Cigeulis,443,6,981655,2020-05-27 13:52:16
818,neque aenean auctor gravida,9 Bartelt Drive,Kliteh,1627,7,175709,2021-03-20 00:16:42
819,odio condimentum id luctus nec molestie sed justo,57 Utah Crossing,Tangtuzhui,1689,7,763361,2020-12-07 09:37:14
820,vivamus metus arcu adipiscing,8212 Main Place,Semboropasar,512,4,43205,2020-06-15 18:34:12
821,ut erat id mauris vulputate elementum nullam varius,817 Eliot Place,Teruel,836,5,440160,2020-09-06 04:33:36
822,magna ac consequat metus sapien ut nunc vestibulum,40 Knutson Hill,Faya-Largeau,1949,2,269156,2020-07-21 18:57:16
823,risus semper porta volutpat,37319 Summer Ridge Drive,Montgomery,268,1,172200,2021-05-20 00:22:25
824,donec dapibus duis,87909 8th Drive,Bouabout,286,10,36470,2020-10-28 13:29:24
825,praesent id massa id nisl venenatis lacinia aenean,51912 5th Lane,Jianmin,1315,9,661086,2020-11-17 13:49:23
826,venenatis non sodales,68972 Randy Center,Sukasari,1732,6,55503,2020-06-02 02:06:59
827,pharetra magna ac consequat metus sapien ut,29 Waubesa Circle,Nangka,23,9,758789,2020-08-01 04:31:36
828,justo maecenas rhoncus aliquam,76452 Macpherson Drive,Skhodnya,186,1,17685,2021-05-17 04:40:34
829,ipsum aliquam non mauris morbi non lectus aliquam,59587 Hagan Way,Okhtyrka,1078,5,271703,2020-11-21 15:48:50
830,at nunc commodo placerat praesent blandit,7 Bunting Way,Herrljunga,1763,8,87356,2020-12-08 03:13:43
831,aliquam quis turpis,3061 Victoria Crossing,Graneros,1035,9,375064,2021-01-16 15:42:13
832,luctus rutrum nulla tellus in sagittis dui,0151 Pond Way,Zhenxi,57,9,670598,2021-01-15 16:47:56
833,quisque porta volutpat erat quisque erat eros viverra,69997 Rowland Court,Concordia,1850,4,865841,2020-10-08 15:28:04
834,tortor risus dapibus augue,673 Lake View Circle,Santa Rosa,494,1,495956,2020-05-22 01:15:46
835,quam sapien varius ut blandit non interdum in,1939 Nelson Hill,Jipijapa,1840,4,145903,2020-09-20 00:48:36
836,convallis duis consequat dui,3 Banding Parkway,Libice nad Cidlinou,1459,10,434876,2021-04-17 16:27:15
837,varius nulla facilisi cras,7 Donald Point,Hanzhong,1782,1,688733,2020-07-26 06:52:54
838,erat vestibulum sed magna,7 Marquette Crossing,Siilinjärvi,1935,3,928119,2021-02-05 17:14:20
839,rutrum ac lobortis vel,156 Meadow Valley Hill,Georgiyevka,862,3,733861,2020-07-25 18:11:08
840,sapien a libero nam dui proin,75477 Delaware Avenue,Wenbi,1857,1,742244,2020-05-17 15:27:28
841,at turpis a pede posuere nonummy integer,82 Bobwhite Road,Nganane,1573,8,237224,2021-01-08 03:34:58
842,erat volutpat in congue etiam justo,72409 Lake View Avenue,Chiduo,598,8,723780,2021-02-10 18:38:29
843,commodo placerat praesent blandit nam nulla integer,26401 Southridge Junction,Nunhala,1867,9,816565,2021-04-11 08:32:37
844,cras in purus,6 Hooker Lane,Hongmei,689,10,217607,2021-02-26 18:11:40
845,at nunc commodo placerat praesent blandit nam nulla,4337 Oxford Lane,Santa Marta,1931,1,275539,2021-05-05 01:46:34
846,purus eu magna vulputate,56625 3rd Crossing,Klwów,295,6,64942,2020-09-28 11:54:30
847,integer aliquet massa id,8980 Rutledge Junction,Beibao,1147,7,768763,2020-06-19 09:12:35
848,nec nisi vulputate nonummy maecenas,296 Menomonie Avenue,Duvergé,1964,4,514591,2020-06-07 22:16:59
849,et eros vestibulum ac est lacinia,5 Bartillon Circle,Shimen,763,10,538423,2021-05-03 16:41:16
850,sed accumsan felis ut at dolor,5 Garrison Parkway,Tromsø,1464,2,487571,2020-12-14 15:42:08
851,tortor id nulla ultrices aliquet maecenas,4712 David Street,Queimados,1405,10,689561,2021-04-23 07:04:59
852,mattis pulvinar nulla pede,3532 Mayer Street,Tiaodeng,1501,1,526736,2020-10-23 07:25:08
853,condimentum neque sapien placerat ante,0614 Pennsylvania Center,Helsingborg,1153,5,771862,2020-11-29 21:39:02
854,erat vestibulum sed magna at nunc commodo,6 Buhler Pass,Orivesi,847,3,898729,2020-09-05 01:04:00
855,natoque penatibus et,669 Randy Park,Nūr,1012,5,337390,2020-05-20 20:44:08
856,proin leo odio,7 6th Street,Varpaisjärvi,1775,7,265436,2021-04-19 14:53:05
857,hac habitasse platea dictumst maecenas ut massa,6 Meadow Valley Alley,Manga,155,10,776302,2021-04-03 19:51:46
858,ut rhoncus aliquet pulvinar,9 Northport Circle,Yecun,556,1,181151,2020-12-18 10:58:54
859,orci pede venenatis non,652 Grover Junction,Urbano Noris,865,3,366471,2020-12-26 21:23:23
860,consequat in consequat ut nulla sed,14092 Knutson Drive,Nantes,617,7,115635,2021-04-04 19:28:55
861,ultrices posuere cubilia curae donec,4 Lakewood Junction,Wierzawice,466,4,662212,2021-01-11 08:12:50
862,diam cras pellentesque,453 Waxwing Circle,Uzyn,1663,2,878314,2020-08-30 14:50:29
863,ultrices libero non mattis pulvinar nulla,7 Eastwood Trail,Budapest,1513,8,557546,2020-08-23 21:42:13
864,primis in faucibus orci,71359 Old Shore Plaza,Qarah Ẕīā’ od Dīn,496,10,761615,2021-04-10 00:42:38
865,potenti in eleifend quam a odio in,0068 Sherman Court,Chandal Bā’ī,772,10,912205,2020-11-04 11:10:39
866,viverra diam vitae quam suspendisse potenti,27 Twin Pines Alley,Maayong Tubig,1976,2,850256,2020-07-27 08:02:42
867,augue a suscipit nulla,98531 Troy Terrace,Changchi,1381,2,303292,2020-12-30 01:17:52
868,semper rutrum nulla nunc purus phasellus in felis,94271 Kennedy Alley,Padilla,1242,8,435985,2021-05-16 18:44:07
869,curae donec pharetra,17 Claremont Trail,Gaio,422,10,820991,2020-07-06 18:49:16
870,odio donec vitae nisi nam,35049 Swallow Terrace,Balsas,1183,6,13214,2020-10-25 02:37:01
871,in magna bibendum imperdiet nullam orci pede,846 Mcbride Avenue,Lancang,1890,5,300912,2020-10-20 13:06:55
872,orci luctus et ultrices,24193 Roxbury Place,Jiangjia,1065,7,305521,2020-11-20 10:14:52
873,posuere nonummy integer non velit,7178 Roxbury Lane,Hengdian,1552,5,809696,2020-10-15 08:08:18
874,libero quis orci nullam molestie,71 Delaware Road,Huikou,917,4,470323,2020-09-06 00:50:27
875,nullam orci pede venenatis non sodales,2 Trailsway Way,Krajan,1380,2,66543,2020-06-24 07:01:26
876,phasellus sit amet erat nulla tempus vivamus in,2 Homewood Place,Ciawi,1561,10,941013,2021-01-18 17:59:40
877,in tempor turpis nec euismod scelerisque,303 Commercial Drive,Carriedo,539,7,987317,2021-01-03 22:56:45
878,augue vestibulum ante ipsum primis in,36370 Forest Point,Caibarién,1710,3,164889,2020-07-13 01:22:04
879,morbi odio odio elementum eu interdum,82 Boyd Hill,Uppsala,856,3,731595,2021-05-06 16:41:40
880,ipsum primis in faucibus orci luctus et ultrices,48760 Almo Park,Vladimirskaya,232,6,784093,2020-10-17 13:57:57
881,mi nulla ac enim,516 Roth Place,Planeta Rica,393,7,543510,2020-12-16 02:48:10
882,montes nascetur ridiculus mus etiam vel augue vestibulum,494 South Point,Jiguan,66,10,302540,2020-10-05 02:36:27
883,quisque arcu libero rutrum ac,3 Westend Hill,Xianglong,768,4,320404,2021-02-07 07:03:51
884,nam congue risus semper,803 Bartillon Pass,Oumiao,1613,5,388945,2020-09-14 11:51:22
885,pretium iaculis diam erat fermentum justo nec condimentum,16 Iowa Park,Barrancabermeja,1134,2,338419,2020-11-21 07:25:33
886,eget nunc donec,58476 Warner Alley,Kasreman Wetan,551,4,267531,2020-12-04 18:52:53
887,amet turpis elementum ligula vehicula consequat,0 Graceland Junction,Amherstburg,1928,7,714768,2020-10-01 22:10:56
888,dolor vel est,60 Talmadge Hill,Suocheng,790,1,680796,2020-12-13 20:10:42
889,elit proin interdum mauris non ligula pellentesque ultrices,3315 2nd Road,Chaiyo,673,5,954060,2020-11-13 10:13:30
890,nulla pede ullamcorper augue a suscipit,1218 Charing Cross Trail,Kętrzyn,296,2,350135,2021-05-13 15:24:09
891,sed nisl nunc rhoncus dui vel sem sed,72513 Stephen Hill,Santa Clara,1835,6,916974,2020-07-05 03:47:30
892,sagittis sapien cum sociis natoque penatibus,1376 Gerald Avenue,Changbao,912,6,771595,2021-01-13 20:47:25
893,odio curabitur convallis,502 Summerview Court,Shizi,136,10,345729,2020-05-27 22:16:55
894,in imperdiet et commodo vulputate justo in,71 Montana Point,Gigante,822,2,200166,2021-01-16 09:04:12
895,porta volutpat quam pede lobortis ligula sit,57 Emmet Park,Māwiyah,569,7,888884,2021-04-20 08:58:19
896,sapien sapien non,31472 Linden Terrace,Ngembul,1738,7,837583,2020-06-16 23:01:21
897,amet diam in magna,4 Vera Avenue,Rotterdam postbusnummers,606,1,589039,2021-03-18 15:46:31
898,bibendum imperdiet nullam orci pede venenatis,7 International Court,Kovářská,137,4,97918,2020-05-21 10:40:41
899,libero nam dui proin,744 Grayhawk Road,Tver,1076,9,566610,2021-01-27 20:04:16
900,aliquet at feugiat non pretium,1730 Esker Hill,Nong Muang Khai,1315,4,267475,2020-09-23 19:30:13
901,penatibus et magnis dis parturient montes nascetur ridiculus,08 Hayes Lane,Longsha,1766,1,481087,2021-05-18 14:49:21
902,augue vestibulum ante,7852 Mallory Street,Kirkland Lake,510,5,409866,2021-01-29 01:40:18
903,integer pede justo lacinia eget,6782 New Castle Circle,Albany,31,10,347667,2020-08-12 04:18:05
904,vestibulum sagittis sapien cum,35 Manley Alley,Umuquena,442,2,804211,2020-07-18 05:55:50
905,nulla suspendisse potenti cras in,73042 Farwell Avenue,Wieczfnia Kościelna,497,5,64780,2020-12-19 04:43:37
906,suscipit ligula in lacus,71 Meadow Ridge Terrace,Herīs,89,8,303622,2021-01-18 13:30:06
907,mauris laoreet ut rhoncus aliquet,48840 Meadow Vale Avenue,Wieczfnia Kościelna,1800,7,51375,2021-04-15 10:17:11
908,habitasse platea dictumst etiam faucibus cursus,2239 Esker Way,Nagoselo do Douro,1912,10,83678,2020-06-01 20:33:19
909,sapien varius ut blandit non interdum,5658 Golf Parkway,Dzików Stary,493,8,92543,2020-08-15 15:50:14
910,turpis eget elit sodales scelerisque mauris sit,26 Farragut Point,Kouloúra,374,2,688126,2020-07-03 05:32:34
911,non velit nec nisi vulputate nonummy maecenas,9266 Sachtjen Terrace,Cabinteely,1001,10,133451,2020-05-21 09:26:41
912,metus sapien ut nunc,47 Spenser Junction,Jūrat ash Sham‘ah,1148,5,937021,2021-03-05 22:03:15
913,integer pede justo lacinia eget tincidunt eget tempus,05 Havey Alley,Banaran,1277,3,556419,2020-07-25 15:50:12
914,dapibus dolor vel est donec odio justo sollicitudin,9940 Texas Avenue,Paris 09,908,4,916149,2021-03-05 03:17:38
915,at nibh in hac habitasse platea,49 Saint Paul Circle,Dzhankoy,218,3,192937,2020-05-20 09:40:39
916,in consequat ut nulla sed accumsan felis ut,09 Tony Parkway,Valday,448,10,44040,2020-11-27 08:40:31
917,justo maecenas rhoncus aliquam lacus,922 Prentice Terrace,Sumqayıt,528,2,790656,2020-09-02 10:52:04
918,dis parturient montes nascetur ridiculus mus,2 Schlimgen Court,Yinhedahan’er,941,8,683548,2020-10-14 22:20:39
919,metus aenean fermentum donec ut mauris,0 Tennyson Road,Wangmeng,1712,9,224544,2021-04-06 14:25:13
920,pharetra magna ac consequat metus,971 Lakewood Gardens Parkway,Xishan,1437,1,356588,2020-10-08 17:41:32
921,primis in faucibus,82534 Artisan Plaza,Bantarpanjang,631,1,75055,2020-11-08 17:35:31
922,potenti cras in purus eu magna vulputate,84 Northfield Lane,Río Limpio,1296,5,47955,2021-01-27 14:39:45
923,in faucibus orci luctus et ultrices,12364 Stuart Place,Nerekhta,996,8,240493,2021-01-26 23:02:09
924,quis orci nullam molestie nibh,0836 Sutherland Street,Kasangulu,317,2,960469,2021-03-24 07:28:35
925,ac leo pellentesque,6074 Scott Lane,Ganjiangtou,696,8,618117,2020-09-15 18:48:28
926,faucibus orci luctus,1 Birchwood Point,Karangasem Laok,854,7,370791,2020-06-19 04:49:44
927,porttitor id consequat in consequat ut,400 Gerald Terrace,Pulap,464,8,444342,2020-05-26 05:32:26
928,purus eu magna vulputate,161 Washington Drive,Medang,38,1,907199,2020-08-30 13:03:24
929,leo maecenas pulvinar lobortis est phasellus sit,2 Monument Trail,Mocajuba,1038,10,291087,2020-12-30 11:42:40
930,primis in faucibus orci,67457 Corry Way,Huangbei,309,4,88198,2021-04-28 19:28:09
931,et ultrices posuere cubilia,1390 Little Fleur Parkway,Doumen,1910,6,179899,2020-10-02 11:34:32
932,maecenas tincidunt lacus at velit vivamus vel,76825 Declaration Pass,Ussel,1967,6,851003,2021-02-07 22:26:20
933,integer pede justo,0884 Harper Center,Seattle,1533,10,301752,2021-01-20 10:12:17
934,erat tortor sollicitudin mi sit,7652 Banding Circle,Dhahab,1824,2,203872,2020-09-17 22:49:34
935,convallis tortor risus,9 Blue Bill Park Street,Poitiers,1806,4,238691,2020-07-28 15:41:25
936,ultrices vel augue vestibulum ante ipsum primis,28694 Blue Bill Park Trail,Dongshan,820,10,200454,2021-01-23 07:39:43
937,nec condimentum neque sapien placerat,68 Hermina Trail,Tisco,397,9,354819,2020-10-26 10:16:43
938,in faucibus orci luctus,45 Spaight Drive,Firá,1404,2,261268,2020-07-16 10:11:15
939,turpis donec posuere metus vitae ipsum,82000 Golf Course Terrace,Palma De Mallorca,1771,9,290971,2021-03-09 14:23:28
940,orci vehicula condimentum curabitur in libero ut massa,22 Petterle Center,Wang’er,1090,8,698698,2020-06-21 10:10:49
941,vulputate vitae nisl aenean lectus pellentesque,1 Starling Terrace,Pokhvistnevo,892,7,529830,2020-06-10 15:06:04
942,sed magna at nunc commodo placerat praesent blandit,183 1st Circle,Itaí,1218,2,712810,2021-03-15 12:30:39
943,pede posuere nonummy integer non velit,27232 Roth Circle,Yacuíba,1868,6,266921,2020-12-19 13:28:44
944,phasellus sit amet erat nulla tempus,409 Hagan Crossing,Loshnitsa,1599,7,262334,2021-03-09 07:14:12
945,viverra diam vitae quam,4098 Harbort Trail,Kamloops,1720,3,99835,2020-08-23 14:42:41
946,eleifend quam a odio in hac habitasse platea,887 Delaware Alley,Yunji,1324,1,351895,2020-06-30 22:36:01
947,cras mi pede malesuada in imperdiet et,268 Hazelcrest Court,Herzliya Pituah,998,9,177258,2020-07-29 12:08:52
948,elementum eu interdum eu tincidunt in,352 Hoard Drive,Tsybulevka,657,3,424584,2020-12-21 02:34:50
949,at velit vivamus vel,667 Stone Corner Crossing,Matos da Ranha,667,7,648508,2021-01-24 07:44:41
950,placerat praesent blandit nam nulla,806 Debs Lane,Bakersfield,96,10,379032,2020-05-18 08:28:57
951,ipsum praesent blandit lacinia,07769 Memorial Lane,Belene,152,4,65256,2020-12-16 04:12:38
952,malesuada in imperdiet et commodo vulputate justo in,43 South Point,Unaizah,1033,1,326288,2020-06-02 01:43:54
953,odio cras mi,582 Fallview Junction,Gapyeong,644,3,239230,2020-05-20 12:49:37
954,nisl aenean lectus pellentesque,47 Sherman Plaza,Plumtree,844,8,583281,2020-06-27 06:46:42
955,imperdiet et commodo vulputate justo,53066 Kim Place,Midoun,1370,7,679768,2020-10-08 02:48:27
956,lobortis sapien sapien non mi,40579 Artisan Junction,Quebo,315,3,125729,2020-08-03 07:24:37
957,pede justo eu massa donec dapibus,1109 Warbler Junction,Apatin,791,1,895469,2020-05-18 13:28:05
958,odio curabitur convallis,782 Waxwing Park,Kosti,713,3,893654,2020-06-01 20:58:25
959,ultrices aliquet maecenas leo odio,05181 Stoughton Crossing,Jaro,787,9,579558,2020-09-09 14:13:53
960,lectus pellentesque at,58553 Esch Center,Obukhiv,1179,9,944597,2020-08-27 23:50:05
961,donec pharetra magna vestibulum,494 New Castle Point,Curití,360,4,882614,2020-10-27 06:15:35
962,neque libero convallis eget,623 Granby Court,Gharavŭtí,393,6,802923,2020-11-07 01:40:09
963,donec dapibus duis,22 Northview Plaza,Yefremov,328,8,240915,2020-06-03 01:13:06
964,mauris morbi non lectus,08062 Duke Plaza,Rönninge,1986,8,651091,2020-10-17 10:36:53
965,pulvinar sed nisl,15 Kipling Avenue,Oberá,769,3,216317,2021-03-22 14:23:01
966,ac est lacinia nisi,9271 Graceland Circle,Spas’ke,519,4,281467,2020-06-20 13:37:15
967,erat eros viverra eget congue eget semper,4111 Emmet Hill,Podporozh’ye,1767,6,247067,2020-10-27 06:40:25
968,lacus curabitur at ipsum ac tellus semper interdum,4775 Clarendon Center,Krajan Demit,1802,8,974929,2020-07-14 11:52:27
969,nulla integer pede justo,815 Merchant Crossing,Krzykosy,1592,7,685206,2021-02-26 20:17:50
970,semper rutrum nulla nunc purus,480 Maywood Court,Usatove,1581,8,640607,2020-10-29 22:33:24
971,proin interdum mauris non ligula pellentesque ultrices,8326 Schiller Park,Muara Siberut,1558,1,614694,2020-06-07 21:12:42
972,lobortis est phasellus,991 Quincy Place,Ribeirão Pires,343,8,843275,2020-06-10 20:29:35
973,ante ipsum primis in,667 Sauthoff Alley,Saitama,1913,8,144792,2020-06-03 18:01:29
974,tincidunt in leo,31395 Ludington Way,Oklahoma City,1173,7,450118,2021-04-23 07:12:02
975,sapien urna pretium nisl ut,2 Lillian Plaza,Jõgeva,54,6,582611,2021-01-08 02:08:44
976,at turpis a pede,32664 Esch Drive,Zilupe,243,8,753445,2021-04-21 00:44:31
977,magna vestibulum aliquet ultrices erat,1 Bultman Court,Morondava,591,1,917091,2021-03-29 20:45:26
978,nec dui luctus rutrum nulla tellus in sagittis,62427 Moulton Crossing,Natu,1992,3,300454,2020-11-08 19:48:53
979,massa donec dapibus,0 1st Street,Cikuya,620,8,997372,2020-10-06 23:39:44
980,tellus semper interdum mauris ullamcorper purus,09304 Russell Plaza,Kaputian,1979,3,450273,2021-02-04 10:09:40
981,lorem quisque ut erat curabitur,46 Johnson Pass,Cabaiguán,1774,8,280239,2020-11-20 13:11:50
982,enim in tempor turpis nec euismod scelerisque,2 Truax Crossing,Xin’an,1915,10,685291,2020-06-06 08:04:09
983,mus etiam vel augue,5896 Sage Junction,Glugu,1762,9,595554,2021-04-25 16:50:24
984,nascetur ridiculus mus vivamus,1 Schmedeman Junction,Dengzhou,1381,9,233128,2021-01-28 22:44:42
985,sagittis dui vel nisl,648 Sutteridge Point,Feikeng,1865,4,804097,2020-11-16 06:55:23
986,quis tortor id,777 Golf Crossing,Kota Kinabalu,324,3,937597,2020-12-17 14:57:25
987,odio in hac habitasse,69652 Hanson Park,Domaradz,951,7,519547,2021-03-22 18:15:42
988,eros suspendisse accumsan tortor quis,3 Heath Park,Złoty Stok,1895,9,614470,2020-06-12 01:45:57
989,eu mi nulla ac,794 Harbort Circle,Pak Phanang,1552,5,121776,2020-10-30 03:23:29
990,porttitor lacus at turpis donec,54620 Schmedeman Parkway,Janas,662,2,378943,2021-03-08 11:57:56
991,eu est congue elementum in,05152 Sundown Hill,Figueiredo,217,4,365799,2021-04-03 00:43:16
992,fusce posuere felis sed lacus morbi,73366 3rd Point,Beit Horon,1889,2,93259,2021-02-14 01:07:52
993,ante ipsum primis in faucibus orci luctus,9742 Coolidge Lane,Tolomango,593,7,951508,2020-12-15 06:48:16
994,volutpat quam pede lobortis ligula sit amet eleifend,5924 Stang Street,San Andrés,499,7,914308,2021-03-08 16:12:39
995,integer a nibh in quis justo maecenas rhoncus,666 Green Plaza,Guaratinguetá,162,2,915923,2020-07-01 15:30:22
996,luctus et ultrices posuere cubilia,5 American Way,Yuen Long Kau Hui,748,7,213987,2020-11-23 11:49:12
997,ipsum primis in faucibus orci luctus,6 Myrtle Way,Mankono,1869,8,664199,2020-09-06 19:43:17
998,lectus aliquam sit,709 Everett Terrace,Mingcheng,942,4,880258,2020-07-09 05:12:15
999,ipsum primis in faucibus orci,590 Roth Drive,Liugong,1508,3,615867,2020-11-19 04:48:18
1000,vulputate elementum nullam varius nulla facilisi cras,915 Dawn Place,Cambanay,1116,2,804212,2020-08-29 09:11:53
