1,proin risus praesent lectus vestibulum quam sapien,47052 Thompson Hill,Carvalhal da Aroeira,641,10,925741,2020-11-19 08:04:44
2,ultricies eu nibh quisque id,78796 Carpenter Place,Skrwilno,362,8,655138,2021-04-07 23:54:51
3,mi pede malesuada in imperdiet et,109 Kedzie Point,Río Cauto,974,2,138905,2020-08-28 08:00:58
4,morbi ut odio cras mi pede malesuada in,687 Pearson Drive,Sundbyberg,1001,3,399434,2020-08-04 04:16:31
5,enim sit amet nunc,0400 Hoffman Trail,Huayana,290,2,30415,2021-03-11 20:13:44
6,iaculis justo in hac habitasse platea dictumst,320 Westend Way,Quince Mil,1683,8,570246,2020-08-29 07:11:08
7,gravida nisi at nibh in hac habitasse,28 Portage Avenue,Agua Blanca,569,4,309623,2020-11-03 03:15:42
8,ipsum ac tellus semper interdum mauris,7432 Troy Street,Americana,630,10,352379,2021-02-02 10:43:54
9,sapien urna pretium nisl,383 Kings Court,Mocímboa,397,10,567778,2020-08-28 12:43:06
10,dignissim vestibulum vestibulum ante ipsum primis,28782 Vernon Pass,Penha Longa,1567,6,387079,2021-04-11 04:43:02
11,venenatis non sodales sed,6007 Springview Terrace,Lancheng,1820,3,594558,2020-07-07 04:58:04
12,semper est quam pharetra magna,73774 Troy Drive,Colomi,408,7,85389,2021-05-23 06:37:53
13,vitae nisl aenean,28 Sullivan Street,Sykiés,1983,10,119125,2020-08-17 23:39:59
14,eu magna vulputate luctus,79759 Hoepker Plaza,Norrköping,394,6,175886,2020-11-17 08:56:38
15,sed lacus morbi sem mauris laoreet,89 Acker Way,Liangdang Chengguanzhen,1397,5,78092,2020-07-12 05:32:52
16,diam vitae quam suspendisse,0509 Jenifer Hill,Correia Pinto,111,8,534128,2020-06-07 09:36:22
17,in tempor turpis nec euismod scelerisque,12 Erie Avenue,Évry,1993,6,670530,2021-04-10 14:08:54
18,proin leo odio porttitor id consequat,7 Corben Junction,Sogod,1999,5,567203,2021-02-25 12:09:26
19,mus vivamus vestibulum sagittis,771 Bowman Alley,Yanaul,338,9,252502,2021-05-07 15:19:01
20,in tempor turpis nec euismod scelerisque quam,8 Northview Parkway,Hejia,686,4,169791,2020-12-11 19:35:54
21,turpis eget elit sodales scelerisque,17769 Merchant Drive,Ponong,1129,9,290444,2020-11-03 06:09:32
22,orci luctus et ultrices posuere cubilia curae duis,25 Old Shore Park,Victoria,760,3,541655,2020-06-19 23:28:03
23,pretium quis lectus suspendisse potenti in eleifend quam,1706 Scofield Terrace,Sremska Mitrovica,1649,8,528316,2020-07-07 17:52:14
24,non pretium quis lectus suspendisse,92015 Westport Lane,Huancapi,1354,8,319579,2020-07-01 06:14:48
25,auctor gravida sem praesent id massa id,7 Blaine Way,Chãos,471,3,962609,2021-03-07 19:29:33
26,vitae consectetuer eget,05802 Eliot Lane,Prizren,1582,2,994730,2021-03-22 01:07:44
27,quam turpis adipiscing,17 Debs Drive,Pariaman,1626,10,370899,2020-06-08 12:42:12
28,nisi venenatis tristique fusce,9568 Mitchell Hill,Stocksund,1208,3,782436,2020-12-20 21:04:07
29,purus eu magna vulputate,81832 Tennyson Circle,Grzęska,1472,7,310741,2020-12-12 14:48:23
30,molestie sed justo,55469 Kennedy Plaza,Río Blanco,1239,5,851065,2020-12-31 11:31:50
31,tempus semper est quam pharetra magna,197 Thackeray Street,Al Abyār,1001,6,759215,2020-05-27 22:04:28
32,adipiscing molestie hendrerit at vulputate,19 Washington Junction,Likupang,1147,4,908837,2020-12-15 21:54:23
33,mi sit amet lobortis sapien,3 Stephen Circle,Hidalgo,1453,5,145362,2020-09-05 04:29:51
34,interdum mauris ullamcorper purus sit,97 International Place,Folques,356,8,953364,2020-06-03 16:18:57
35,vel nisl duis,91 Brentwood Trail,Jiaozhou,374,2,173642,2020-10-29 11:32:14
36,libero non mattis pulvinar,2436 Havey Road,Jiangqiao,498,1,25789,2021-04-19 13:43:36
37,volutpat erat quisque,5101 Hoepker Alley,Kyaiklat,469,2,380042,2020-12-27 20:31:28
38,convallis tortor risus dapibus augue,976 Mcguire Parkway,Jinshan,1792,8,876437,2020-08-23 11:09:53
39,viverra eget congue eget semper rutrum nulla,4 Heffernan Terrace,Zdíkov,1772,8,259126,2021-02-19 22:55:19
40,quisque arcu libero rutrum ac lobortis vel dapibus,21 Nova Pass,Armstrong,620,2,876357,2021-02-08 12:06:54
41,risus auctor sed tristique in tempus sit,3456 Ronald Regan Hill,Žihle,1254,1,988805,2021-03-30 07:24:40
42,donec posuere metus vitae ipsum aliquam non,0197 Morning Trail,Bachuan,1514,6,371882,2020-09-17 14:35:02
43,porta volutpat erat quisque erat,8412 Melody Lane,'s-Hertogenbosch,1036,4,149488,2020-11-13 04:46:32
44,sollicitudin ut suscipit a feugiat et eros,3462 Harper Junction,Marisol,1351,4,862241,2021-01-07 20:51:07
45,sagittis dui vel nisl duis ac nibh fusce,743 Westend Place,Xiaji,1082,7,448871,2021-03-05 05:56:11
46,faucibus accumsan odio curabitur convallis duis consequat dui,7978 Talmadge Road,Xiangshan,508,1,999425,2021-05-03 02:04:17
47,justo aliquam quis turpis eget elit,85209 Northwestern Pass,Tashang,465,2,916628,2021-03-11 14:22:52
48,pede justo eu massa,0228 Cherokee Road,Pailiao,1860,7,714011,2021-04-04 15:10:52
49,accumsan odio curabitur convallis duis,834 Pond Parkway,Tāndo Mittha Khān,696,9,68008,2021-03-26 14:53:27
50,nulla suscipit ligula in,11 Blackbird Point,Burujul,1745,7,336193,2020-09-13 23:22:05
51,quam turpis adipiscing lorem vitae mattis nibh ligula,726 Elka Drive,R S,466,9,865304,2020-08-14 00:56:28
52,justo sollicitudin ut suscipit a feugiat et,8 Mccormick Plaza,Munjungan,1398,9,572222,2020-09-24 07:35:42
53,congue eget semper rutrum nulla nunc purus,3 Killdeer Trail,Trinity,889,9,548656,2020-09-25 15:05:25
54,duis bibendum morbi non quam,9 Heath Place,Baoxia,159,8,775314,2020-10-26 01:55:12
55,est et tempus semper est quam,9214 Arkansas Crossing,Langtou,1063,5,506505,2020-09-06 02:11:25
56,pellentesque volutpat dui maecenas tristique est,3 Fieldstone Drive,Abilay,1957,4,225541,2020-12-31 15:10:11
57,in hac habitasse platea dictumst aliquam,16 Grover Point,Choroszcz,1677,6,470531,2020-08-16 14:22:12
58,lectus pellentesque eget nunc donec,9663 Ilene Court,Garupá,1383,5,302209,2020-07-24 11:36:25
59,rhoncus aliquet pulvinar sed,3 Mariners Cove Center,Joroinen,1785,7,198147,2021-03-03 00:40:05
60,varius ut blandit non interdum in,49321 Manitowish Way,Ust’-Izhora,1683,2,192399,2020-09-15 14:31:59
61,consequat nulla nisl nunc nisl duis bibendum felis,6 Armistice Terrace,Psary,1912,7,501508,2020-07-15 20:06:39
62,praesent lectus vestibulum,9559 Bay Crossing,Dawu,1755,2,993110,2020-07-20 05:27:06
63,pede malesuada in imperdiet,99 Crest Line Street,Nyköping,1466,9,236916,2020-08-30 08:15:42
64,turpis integer aliquet massa id lobortis convallis,804 Jana Crossing,Kaputian,289,8,302804,2020-12-17 05:28:59
65,tortor eu pede,5521 Fuller Alley,Hoeryŏng,1284,8,862417,2020-10-09 21:19:52
66,eu magna vulputate luctus cum sociis,2153 Bluejay Terrace,Lankaran,1879,6,753244,2021-05-16 19:32:18
67,velit donec diam neque vestibulum eget,72 Blaine Place,Polomolok,472,8,859671,2020-12-12 01:03:16
68,ut massa quis augue luctus tincidunt,58 Golden Leaf Court,Lupak,292,3,335455,2021-05-18 13:22:50
69,blandit nam nulla integer pede justo lacinia,0 Hooker Lane,Tarata,385,7,252188,2021-01-10 13:41:54
70,in blandit ultrices enim,173 Homewood Street,Shirgjan,1752,4,396711,2020-08-18 13:10:16
71,scelerisque mauris sit amet eros suspendisse accumsan tortor,84869 Carioca Terrace,Lélouma,946,10,576497,2020-12-24 21:50:36
72,tristique tortor eu,67 Westridge Lane,Quebradas,642,5,865733,2021-03-25 03:41:18
73,erat quisque erat eros viverra eget congue,296 Forest Court,Changmao,659,9,467463,2021-04-19 16:56:45
74,ac leo pellentesque ultrices mattis odio donec,3810 Prentice Hill,Yekimovichi,1787,10,660398,2021-02-07 10:25:10
75,velit nec nisi vulputate nonummy maecenas,86556 Daystar Junction,Chipinge,1874,10,646451,2020-05-30 13:57:20
76,tristique fusce congue diam id,769 Coleman Circle,Haugesund,470,9,106892,2020-10-27 18:01:50
77,vestibulum aliquet ultrices erat tortor sollicitudin mi sit,7 Farmco Crossing,Srebrenik,1443,6,143227,2021-01-09 20:53:54
78,potenti cras in purus eu magna vulputate,2 Holy Cross Street,Bukal Sur,1888,1,615947,2020-09-20 05:52:30
79,fermentum justo nec condimentum neque,1172 Surrey Park,Fermelã,431,1,81092,2021-03-14 13:00:10
80,ipsum dolor sit amet consectetuer adipiscing,85732 Lyons Street,Nizhniy Tagil,405,1,126821,2020-08-21 11:40:16
81,sagittis dui vel nisl duis,5967 8th Parkway,Stratónion,1712,4,401855,2020-10-20 15:09:01
82,mattis egestas metus aenean fermentum donec ut,35985 Rigney Alley,Chakaray,394,10,541345,2020-09-26 17:53:45
83,eget orci vehicula condimentum,55992 Dahle Road,Manouba,1199,2,839212,2020-12-22 21:58:17
84,at nunc commodo,6 Golf Crossing,Midlands,1934,3,751504,2020-07-11 09:46:45
85,ultrices libero non,3960 Michigan Park,Baquero Norte,355,8,487900,2020-10-24 22:16:29
86,cursus urna ut tellus nulla ut erat id,4 Oak Valley Park,Hošťka,68,2,864390,2020-05-17 20:04:27
87,interdum eu tincidunt in,0595 Park Meadow Plaza,Ginebra,646,7,819528,2020-10-10 11:24:51
88,quis libero nullam sit amet turpis,0973 Prentice Center,Huolu,532,1,991175,2020-10-03 17:17:50
89,ligula vehicula consequat morbi a ipsum integer,6 Brickson Park Court,Staré Křečany,404,10,569933,2020-05-18 23:16:42
90,magna bibendum imperdiet nullam orci pede venenatis,5 Montana Parkway,Untolovo,592,9,495815,2021-04-29 17:29:06
91,velit nec nisi,81479 John Wall Point,Beitan,891,5,835735,2020-10-16 06:49:28
92,tristique fusce congue diam id ornare imperdiet sapien,56 Dottie Street,Kudang,68,3,889489,2020-06-22 01:38:59
93,faucibus orci luctus et ultrices posuere cubilia,01 Harper Alley,Barra,661,6,719786,2020-06-26 02:56:07
94,nullam sit amet turpis elementum ligula vehicula,36 John Wall Alley,Bogotá,557,3,33519,2020-11-23 21:57:33
95,id ligula suspendisse ornare,1 Warbler Plaza,Xilópolis,1745,5,979799,2021-03-23 18:58:25
96,a suscipit nulla elit ac nulla,031 Artisan Court,Washington,959,8,281368,2020-11-01 16:16:07
97,pede ullamcorper augue a suscipit nulla elit ac,7 Porter Trail,Muaratiga,1670,6,357450,2020-06-07 17:33:47
98,in est risus auctor sed,8964 Sugar Point,Lysice,612,2,296196,2021-04-09 01:42:20
99,scelerisque mauris sit,49298 Bashford Lane,Fukui-shi,811,7,933743,2020-07-18 14:44:03
100,tincidunt nulla mollis molestie lorem quisque ut erat,88072 Redwing Point,Lahat,947,7,3522,2020-09-13 06:00:07
101,ultrices posuere cubilia curae donec,4 Burning Wood Street,Croissy-sur-Seine,1462,2,36401,2021-05-05 07:51:39
102,nibh in lectus pellentesque at nulla suspendisse,76 Helena Court,Jalaud,262,2,983102,2021-04-27 21:29:32
103,id lobortis convallis tortor risus dapibus augue vel,73 Upham Center,Níkaia,471,3,520305,2020-11-15 11:11:37
104,erat nulla tempus vivamus in felis eu sapien,0105 Graceland Avenue,Manadas,830,6,970392,2020-10-26 19:32:22
105,viverra pede ac diam cras pellentesque,7 Cody Court,Mondoteko,335,8,564179,2021-01-23 17:20:31
106,sed augue aliquam erat volutpat in,06596 Boyd Point,Sertãozinho,1052,6,186826,2020-07-22 12:11:20
107,semper est quam pharetra,089 Thompson Avenue,Nunhala,1052,9,256329,2020-12-01 03:29:49
108,augue vel accumsan tellus nisi eu orci mauris,534 Del Mar Avenue,Hiseti,747,9,857756,2021-02-01 18:30:20
109,justo maecenas rhoncus aliquam lacus morbi quis tortor,76822 Fallview Point,Kryevidh,1654,6,680284,2021-05-16 17:11:54
110,at ipsum ac tellus semper interdum,31 Mcguire Terrace,Karlskoga,1107,5,386573,2020-06-18 04:09:46
111,donec pharetra magna vestibulum aliquet ultrices erat tortor,91232 Fordem Crossing,Końskowola,1215,3,459413,2020-12-25 05:38:22
112,rhoncus aliquet pulvinar sed nisl nunc,154 Hermina Court,Radès,1512,4,702649,2020-08-17 18:04:23
113,bibendum morbi non quam nec,3224 Burning Wood Trail,Faḩmah,1247,8,339763,2020-09-09 17:46:44
114,luctus ultricies eu nibh quisque,0612 Iowa Circle,Jiuhu,576,7,718950,2021-02-16 19:46:19
115,nibh fusce lacus purus aliquet at,38266 Fisk Avenue,Changpo,92,5,289738,2020-06-17 00:29:07
116,nam dui proin leo odio,44 Dennis Street,Tanashichō,1143,8,110734,2020-07-24 15:17:17
117,parturient montes nascetur ridiculus mus etiam vel,2 Old Shore Hill,Inđija,1983,6,280838,2020-10-02 23:10:48
118,volutpat eleifend donec ut,4940 Roth Point,Aristóbulo del Valle,1682,10,453310,2020-06-01 19:52:36
119,habitasse platea dictumst aliquam augue quam sollicitudin,148 High Crossing Trail,Rognedino,347,9,779786,2021-04-01 01:45:55
120,ipsum primis in faucibus orci,680 Portage Center,Nagbalaye,337,5,996932,2021-05-12 04:31:43
121,rhoncus aliquam lacus morbi quis,0858 Main Terrace,Yurkivka,282,7,541022,2021-03-13 18:38:31
122,et ultrices posuere cubilia curae,4 West Plaza,Lidköping,617,9,180930,2020-10-22 06:56:32
123,tristique est et,645 Summer Ridge Circle,Holýšov,1139,4,358883,2021-01-10 17:50:39
124,mollis molestie lorem,373 Prentice Junction,Suraż,391,3,260069,2021-01-01 22:36:50
125,ultrices posuere cubilia curae nulla dapibus,30 Shoshone Drive,Dresden,1827,1,390954,2021-03-16 03:26:57
126,ut volutpat sapien arcu sed augue aliquam erat,470 Reindahl Crossing,Bassila,1849,2,412271,2020-06-14 04:01:26
127,augue vestibulum ante ipsum primis in faucibus orci,47 Jenifer Drive,Pangao,864,5,365874,2020-06-24 06:54:46
128,eleifend donec ut dolor morbi,14 Donald Drive,Gwaram,627,3,204052,2021-03-19 07:54:56
129,quisque id justo sit amet sapien,633 Hauk Parkway,Ghār al Milḩ,1586,7,448689,2021-05-10 14:16:10
130,posuere cubilia curae,4 Mallard Avenue,Xichehe,411,7,18586,2021-05-12 05:50:14
131,ut dolor morbi vel lectus in quam,71403 Milwaukee Pass,Dazhan,1827,8,377894,2021-03-06 14:35:57
132,in est risus auctor sed tristique in,929 Eagle Crest Parkway,Qingshan,1808,10,756676,2021-05-07 08:20:52
133,dapibus augue vel accumsan tellus nisi eu,5 Nelson Plaza,Tebara,699,7,326759,2020-11-25 23:03:18
134,est lacinia nisi,05083 Schmedeman Avenue,Tumba,157,3,513785,2021-01-18 08:34:52
135,eu est congue elementum in,42276 Wayridge Trail,Båstad,349,1,287278,2020-06-28 04:09:09
136,id luctus nec molestie sed justo,9 Mccormick Pass,Prokhladnyy,435,4,301735,2021-05-22 05:56:18
137,morbi odio odio elementum eu,00316 Morrow Alley,Beaufort,252,3,768764,2020-06-05 05:35:04
138,penatibus et magnis dis,1041 Commercial Circle,Mentaras,755,5,386625,2021-01-25 19:55:15
139,faucibus orci luctus,110 Lukken Center,Binafun,1323,9,769211,2020-10-27 12:00:03
140,ultrices erat tortor sollicitudin mi sit amet lobortis,553 Montana Court,Kelin,1561,8,770120,2020-05-17 00:41:07
141,in blandit ultrices enim lorem,256 Westport Lane,Velikovechnoye,1040,6,499145,2021-01-18 14:46:26
142,augue vestibulum ante,3225 Dakota Plaza,Brněnec,1903,8,761902,2020-09-03 00:09:31
143,donec semper sapien a,87 Crest Line Circle,Yangsha,77,1,33820,2020-10-19 17:03:35
144,leo maecenas pulvinar,22279 Sheridan Pass,Perpignan,747,9,163255,2020-06-29 14:55:55
145,erat vestibulum sed magna,41078 Dwight Avenue,Luhans’ke,1146,10,913244,2020-07-05 07:23:07
146,nullam orci pede venenatis non sodales sed,01 Welch Point,Ansongo,802,9,500661,2020-06-20 14:11:35
147,sem fusce consequat,79643 Granby Center,Kujang,1920,6,97711,2020-05-18 22:05:18
148,viverra dapibus nulla suscipit ligula in lacus curabitur,6 Everett Way,Santa Catarina Ixtahuacán,745,10,952823,2021-01-13 12:12:33
149,justo sit amet sapien dignissim vestibulum vestibulum,52249 Corben Pass,Injīl,499,5,15066,2020-12-28 19:14:33
150,a nibh in quis justo maecenas rhoncus aliquam,428 Bluejay Terrace,Wuping,1545,5,725435,2021-03-18 07:51:09
151,tortor quis turpis sed ante,106 Arkansas Avenue,Hošťka,1527,3,604086,2021-05-21 00:40:05
152,justo maecenas rhoncus,390 Sachtjen Terrace,Pedra Azul,93,2,82803,2021-01-13 21:50:34
153,odio donec vitae,12 Alpine Way,Wanquan,290,1,227399,2020-09-29 13:16:24
154,nisi venenatis tristique,980 Arkansas Point,København,1107,9,592747,2020-07-26 03:40:41
155,curabitur gravida nisi at nibh in,8826 Daystar Alley,Krajan Karangwage,566,10,321013,2020-05-19 14:12:58
156,diam in magna bibendum imperdiet nullam orci,14 Gerald Way,Qiaotou,36,6,546045,2020-09-17 10:56:37
157,orci mauris lacinia sapien quis,56 Forster Point,Ciwaru,1713,9,805826,2020-05-28 05:59:51
158,in porttitor pede justo eu,06 Menomonie Lane,Dinan,1850,9,405196,2021-02-05 19:19:28
159,semper rutrum nulla nunc purus phasellus in,88318 Carioca Lane,Chavusy,739,5,348863,2020-11-30 11:31:42
160,vel accumsan tellus nisi eu orci mauris lacinia,15 Northland Junction,Liliana,764,8,417884,2020-05-25 20:21:52
161,ridiculus mus etiam vel augue vestibulum rutrum rutrum,94306 Mallard Hill,Igurubi,1003,10,283015,2020-12-31 07:30:28
162,sapien dignissim vestibulum vestibulum ante,5 Northfield Hill,Dzhebariki-Khaya,185,8,224938,2021-05-14 05:38:36
163,vestibulum ante ipsum,7 Springs Parkway,Cipolletti,115,9,546251,2020-06-28 06:37:38
164,augue vel accumsan tellus nisi eu orci,62 Scoville Pass,Qiucun,994,7,175286,2020-10-13 07:08:01
165,tincidunt nulla mollis,292 7th Park,Kulary,1321,8,734823,2020-07-30 04:09:06
166,porta volutpat quam,93916 Prairie Rose Junction,Jun’an,1588,4,923384,2021-04-17 13:03:02
167,vulputate ut ultrices vel,4199 Linden Crossing,Malec,740,3,212982,2021-01-30 09:10:31
168,at nulla suspendisse,65426 Meadow Ridge Place,Maralal,1238,8,251389,2021-02-11 03:28:11
169,turpis integer aliquet massa id,27890 Eastlawn Junction,Garunggang,462,2,488302,2021-02-24 02:48:45
170,platea dictumst morbi vestibulum velit id pretium iaculis,66336 Bonner Parkway,Liangshan,1384,6,239914,2021-01-02 20:13:40
171,massa tempor convallis nulla neque libero convallis,64 Fairview Street,Beicheng,1113,10,85956,2021-05-07 03:30:11
172,venenatis non sodales sed tincidunt eu felis,418 Alpine Pass,Negoslavci,1177,4,623073,2021-01-12 19:56:13
173,cubilia curae mauris viverra diam vitae quam suspendisse,7661 Sheridan Park,Ordóñez,1026,1,844113,2021-03-25 09:18:16
174,mi sit amet lobortis,44 Sutteridge Parkway,Gaoxu,1002,2,519535,2021-02-07 22:06:39
175,dolor sit amet consectetuer adipiscing elit,98524 Anderson Lane,Huacheng,414,3,500149,2020-07-11 08:01:25
176,hac habitasse platea,77098 Ridgeview Place,Maliang,1989,3,421314,2020-10-07 03:11:54
177,lacinia sapien quis libero nullam sit amet,8634 Redwing Place,Sibinal,1821,6,282759,2021-05-16 19:11:13
178,lacinia erat vestibulum sed magna,0985 Carberry Trail,Sakura,49,8,678105,2020-08-14 11:49:43
179,justo nec condimentum neque sapien placerat ante,2 Bowman Terrace,Wschowa,1194,4,834349,2020-08-13 17:21:01
180,lacinia nisi venenatis tristique fusce congue diam id,55 Maple Center,Su-ngai Kolok,1361,2,463671,2021-02-13 04:14:13
181,vulputate luctus cum sociis natoque penatibus et magnis,1464 Upham Place,Plaeng Yao,600,1,165996,2020-05-20 04:46:02
182,velit vivamus vel,6279 Eliot Terrace,Kisangani,681,8,292823,2021-03-21 08:55:20
183,libero nullam sit amet turpis,2 Corry Avenue,Cigarogol,441,7,638379,2021-04-03 12:24:24
184,condimentum curabitur in libero,0660 Utah Plaza,Đắk Mil,709,4,907526,2020-06-12 13:40:01
185,sit amet cursus id turpis integer,917 Scofield Parkway,Waitun,421,9,825645,2021-04-26 23:10:18
186,natoque penatibus et magnis dis,34098 5th Center,São Torcato,1167,7,519668,2020-12-10 03:17:56
187,integer a nibh in quis justo,51 Shelley Point,Nidri,434,7,42159,2020-10-02 10:34:18
188,cursus urna ut tellus nulla ut,80538 Bowman Crossing,Korolev,749,9,503974,2021-01-08 03:35:40
189,aliquam non mauris morbi non,659 Harbort Point,Chilecito,655,6,446724,2021-05-06 15:37:11
190,a suscipit nulla elit,9743 Mayer Terrace,Lubei,1224,4,446998,2020-08-09 04:44:16
191,nulla dapibus dolor vel est donec odio justo,37 Fallview Hill,Tegallega,1776,6,45186,2020-08-29 13:46:56
192,mi pede malesuada in imperdiet et commodo,0 Spenser Place,Longbo,535,8,787869,2021-01-31 10:10:02
193,dapibus dolor vel est donec odio justo,20 Ridge Oak Circle,Xinxikou,804,9,192769,2021-04-11 16:02:14
194,ridiculus mus vivamus,90 Continental Parkway,Sabana Grande de Palenque,31,2,680613,2021-05-07 23:47:01
195,nulla integer pede justo lacinia eget,8376 Nevada Trail,Yingcheng,1808,8,328902,2020-10-29 21:03:00
196,fusce posuere felis sed lacus,0101 Vahlen Parkway,Nova Granada,751,6,316131,2020-11-09 01:07:29
197,quis libero nullam sit amet turpis elementum ligula,4 Mesta Trail,Zolotonosha,1646,10,906368,2020-11-17 15:56:17
198,purus sit amet nulla,67359 Starling Terrace,Bangbayang,881,10,394353,2020-10-27 22:19:34
199,enim blandit mi,924 Havey Drive,Zhongxin,241,8,498322,2020-08-24 00:56:40
200,varius nulla facilisi cras non,920 Blaine Circle,Cibuah,1033,9,136321,2020-12-07 14:13:24
201,nisl duis bibendum,3748 Ridgeway Trail,Huochang,1141,9,851395,2020-09-19 11:56:45
202,id nisl venenatis lacinia,61266 Glacier Hill Center,Aimorés,415,10,764692,2020-07-16 02:45:38
203,ut volutpat sapien arcu sed augue aliquam,7 1st Avenue,Aiquile,218,5,642061,2020-12-16 19:10:11
204,mus etiam vel augue vestibulum rutrum rutrum,6666 Browning Trail,Tiantai,473,1,927693,2020-06-11 20:06:14
205,enim in tempor turpis nec euismod scelerisque quam,953 Oak Valley Circle,Misawa,1940,7,937177,2021-02-21 16:37:24
206,platea dictumst morbi vestibulum velit,22 Milwaukee Center,Ajuda,69,1,886045,2021-04-20 21:15:07
207,odio porttitor id consequat in consequat ut,4 Service Trail,Nianqiao,338,3,154156,2021-04-20 03:33:48
208,augue a suscipit nulla elit ac nulla,6 East Circle,Zuobude,1273,4,151583,2021-05-05 09:24:42
209,nulla dapibus dolor vel est donec,33289 Bobwhite Alley,Västerhaninge,588,5,125954,2020-07-11 03:07:37
210,hendrerit at vulputate vitae nisl aenean lectus,5191 Mandrake Park,Nahiyat Ghammas,1142,3,678437,2021-03-25 23:52:42
211,cum sociis natoque penatibus et magnis,42 Pierstorff Park,Kedungharjo,380,9,573968,2020-09-23 18:10:40
212,arcu adipiscing molestie,02099 Barnett Court,Gaoyu,405,2,436770,2020-06-10 11:10:41
213,in blandit ultrices enim,91883 Hooker Avenue,Asia,323,6,385541,2021-01-05 12:35:35
214,aliquam convallis nunc proin at turpis a,421 Morningstar Pass,San Pedro Carchá,1388,8,60941,2021-05-09 17:51:18
215,nam nulla integer pede justo lacinia eget,4357 Fairview Parkway,Gharyan,173,2,65152,2020-07-21 15:49:45
216,elementum pellentesque quisque porta volutpat erat quisque,13725 Dapin Terrace,Dazaifu,219,10,884241,2021-03-12 14:50:56
217,fermentum donec ut,92 Upham Park,Sollefteå,1651,10,832156,2020-11-21 03:26:11
218,tincidunt in leo maecenas pulvinar lobortis est phasellus,0033 Spohn Avenue,Söderköping,436,2,929169,2020-06-09 10:01:06
219,hac habitasse platea dictumst maecenas ut massa quis,476 Grover Court,Slobodnica,30,10,905404,2020-06-21 09:20:17
220,non ligula pellentesque ultrices phasellus id sapien,2067 North Drive,Cachipay,1647,3,380133,2021-03-31 22:55:23
221,risus semper porta volutpat quam pede,78927 Southridge Street,Elato,1304,3,974292,2020-06-26 22:40:46
222,erat tortor sollicitudin mi sit amet,4 Division Pass,Täby,962,2,266335,2020-12-31 15:29:44
223,etiam justo etiam pretium iaculis justo,33169 Arapahoe Center,Agrelo,1530,2,112198,2020-07-21 11:53:50
224,tortor sollicitudin mi sit amet lobortis sapien sapien,7381 Oakridge Park,Settat,1267,1,255113,2020-08-30 22:27:23
225,etiam justo etiam pretium,42 Nevada Street,Isaka,1285,3,813092,2020-10-05 02:36:29
226,suspendisse accumsan tortor quis,18625 Quincy Court,He’an,1242,6,297017,2020-12-13 21:09:08
227,curae mauris viverra diam vitae quam suspendisse potenti,17 Rockefeller Street,Majan,1442,4,262494,2020-09-08 22:09:30
228,vel dapibus at diam nam tristique tortor eu,519 Milwaukee Drive,Sanxi,1871,3,326184,2020-09-18 15:55:37
229,sed vel enim,01 Welch Circle,Buenavista,1984,10,703284,2021-04-12 00:17:24
230,in felis donec semper sapien a,68 Bultman Pass,Rakhiv,1287,5,66451,2020-08-28 23:27:47
231,id nulla ultrices aliquet maecenas leo odio,46081 Union Alley,Novo-Peredelkino,55,9,910961,2020-12-03 05:40:18
232,lectus in quam fringilla rhoncus mauris enim leo,47 Butterfield Terrace,Krujë,458,1,611612,2021-02-07 16:25:45
233,ultrices posuere cubilia curae nulla dapibus,074 Welch Way,Uthai Thani,1860,9,805161,2020-09-29 10:57:12
234,consequat in consequat ut nulla,77995 Carpenter Court,Olival Basto,1658,5,292592,2021-03-08 23:13:20
235,et tempus semper,59 Kinsman Point,Krajan Menggare,1933,3,265824,2020-10-12 13:15:04
236,nulla tempus vivamus in felis eu,8 Dorton Alley,Karabas,573,10,262715,2021-04-16 04:29:46
237,non pretium quis lectus suspendisse potenti,12 Meadow Ridge Circle,Miguel Hidalgo,746,8,962252,2020-10-18 16:05:54
238,nulla justo aliquam quis turpis eget elit,4698 Independence Place,Sotteville-lès-Rouen,650,2,417584,2021-02-02 23:01:52
239,ut suscipit a feugiat,055 Ridgeway Pass,Benjamin Constant,882,10,691415,2020-07-18 17:19:29
240,quis odio consequat varius integer ac,7892 Amoth Crossing,Voskresensk,715,4,118481,2021-02-13 07:55:56
241,sociis natoque penatibus,86572 Sundown Place,Mardā,1729,2,157180,2021-01-04 21:26:07
242,magna at nunc commodo placerat praesent blandit nam,686 Blue Bill Park Drive,Ballymahon,811,1,36782,2020-12-24 17:27:26
243,cum sociis natoque penatibus et magnis,702 Bonner Place,Pilar do Sul,759,7,452887,2020-11-21 19:22:43
244,quam sollicitudin vitae consectetuer eget rutrum,80586 North Terrace,Suwatu,541,7,417852,2021-03-24 02:02:42
245,imperdiet et commodo,2887 Northfield Street,Huxi,707,6,980880,2020-07-18 12:53:28
246,turpis eget elit sodales scelerisque mauris,824 Amoth Circle,Yaroslavl,1481,2,876704,2021-05-22 08:17:51
247,convallis eget eleifend luctus ultricies eu nibh,1 Upham Crossing,Ponong,67,10,906758,2021-05-04 22:22:41
248,non pretium quis lectus suspendisse potenti in eleifend,7030 Lyons Pass,Jiangchang,1611,8,566449,2021-02-04 14:18:42
249,vitae mattis nibh ligula nec sem duis,2899 Forest Dale Crossing,Aripuanã,1381,7,355843,2020-08-27 19:05:05
250,sed accumsan felis ut at dolor quis odio,14557 Graedel Pass,Peixing,1768,8,62236,2020-12-16 16:16:21
251,sem praesent id massa id nisl venenatis,9 Waywood Street,Tangping,826,3,315687,2020-06-09 11:31:07
252,morbi quis tortor id nulla ultrices aliquet,01 Service Way,Xitou,576,3,308108,2020-09-27 01:51:04
253,vivamus in felis eu,6249 Warbler Way,K’olīto,300,2,561430,2020-12-06 16:22:32
254,eu massa donec,84476 Messerschmidt Plaza,Ar Rass,1029,5,833714,2021-02-10 14:54:34
255,massa quis augue,518 Iowa Plaza,Koutsopódi,231,2,389906,2021-03-29 20:59:16
