506,sem fusce consequat,0285 Anhalt Place,Tit Mellil,886,10,703561,2020-05-30 01:48:38
507,sapien ut nunc vestibulum ante ipsum primis in,26578 Cambridge Parkway,Iznoski,1766,10,853117,2021-01-30 20:37:32
508,lorem integer tincidunt ante vel,0 Grim Center,Loyew,1144,10,148642,2021-04-06 10:59:43
509,pellentesque viverra pede ac diam cras pellentesque volutpat,8 Erie Hill,Mtwara,628,9,316540,2020-11-10 11:48:17
510,accumsan odio curabitur convallis duis,708 Valley Edge Alley,Dongpu,1815,5,481776,2021-03-10 04:22:52
511,quis odio consequat varius integer ac leo,42 Summer Ridge Way,Balite,1532,9,228544,2021-03-22 13:46:06
512,sit amet consectetuer,16286 Londonderry Street,Paris 19,1273,9,552217,2021-01-23 21:42:51
513,nullam varius nulla,774 Troy Trail,Korotych,332,10,768152,2021-03-06 00:21:04
514,accumsan tellus nisi eu orci mauris lacinia sapien,2 Lukken Terrace,Mileb,396,2,257898,2020-11-27 06:54:46
515,diam nam tristique tortor,46 Forest Run Park,Margasari,1475,10,11626,2020-07-02 04:15:49
516,etiam vel augue,8410 Graedel Street,Tengah,673,9,518304,2021-01-09 03:12:19
517,morbi porttitor lorem id ligula suspendisse ornare,926 Spohn Pass,Manevychi,800,2,978395,2021-02-11 13:35:04
518,nibh ligula nec sem duis aliquam convallis,502 Graedel Pass,Armanāz,1580,10,611861,2021-04-30 16:51:22
519,ridiculus mus vivamus vestibulum sagittis,58978 Straubel Center,Guadalupe,752,5,344718,2021-03-13 00:39:55
520,phasellus in felis donec semper sapien a,6 Rutledge Alley,Чегране,1027,4,496295,2021-02-26 21:16:21
521,primis in faucibus orci luctus et,571 Twin Pines Road,Zhangjiayuan,944,8,372369,2020-10-29 07:15:23
522,erat tortor sollicitudin mi sit,91 Killdeer Park,Dniprovka,1953,4,752248,2020-10-10 01:51:15
523,erat quisque erat eros viverra eget congue eget,0144 Mandrake Avenue,Limbuhan,343,5,787371,2021-03-09 11:59:37
524,feugiat et eros,4505 Buena Vista Hill,Haradzishcha,1400,8,268059,2021-01-04 19:08:55
525,donec diam neque vestibulum eget vulputate ut ultrices,15 Farmco Hill,Calamba,880,2,816642,2020-07-14 12:18:49
526,lacus purus aliquet at feugiat non,5 Memorial Avenue,San Roque,741,2,140905,2020-10-10 08:03:30
527,enim leo rhoncus sed vestibulum sit amet cursus,8789 Warner Junction,Shakhun’ya,170,8,451908,2020-07-14 13:03:09
528,in hac habitasse platea dictumst etiam faucibus cursus,68742 Muir Drive,Formosa,603,7,506570,2021-04-17 21:44:26
529,condimentum curabitur in libero ut massa volutpat convallis,82850 Beilfuss Drive,Dongxiao,1276,7,639316,2020-12-04 17:18:28
530,malesuada in imperdiet et commodo vulputate,5 Utah Road,Ust-Kamenogorsk,1973,2,62235,2021-01-18 07:25:08
531,pellentesque ultrices mattis,5 Vera Junction,Formiga,1456,8,584265,2020-12-29 11:59:39
532,vestibulum ac est lacinia nisi,4311 Mosinee Drive,Donostia-San Sebastian,347,4,137972,2020-08-20 04:00:25
533,luctus et ultrices posuere cubilia curae,3 Pearson Point,‘Ayn Ḩalāqīm,569,3,950523,2020-09-26 07:10:56
534,etiam pretium iaculis justo,3 Village Crossing,Ferreira,633,7,469488,2021-02-18 11:07:07
535,pretium nisl ut volutpat sapien arcu,52846 Eggendart Terrace,Tahilt,686,2,270958,2020-09-10 23:55:18
536,pretium iaculis justo in hac,9 Bowman Parkway,Brooklyn,1180,9,300305,2021-02-21 11:44:36
537,ornare imperdiet sapien urna,9532 Bowman Terrace,Mendoza,523,7,763563,2021-03-14 10:40:07
538,consequat metus sapien ut nunc vestibulum ante ipsum,047 Fordem Way,Sumbersari Wetan,1801,10,804628,2020-10-23 03:32:28
539,donec semper sapien a,849 John Wall Plaza,Baishan,1282,8,572038,2020-11-23 02:00:37
540,mattis egestas metus aenean,29 Kingsford Junction,Rashaant,33,6,619894,2020-12-09 23:43:43
541,quisque erat eros viverra eget congue eget,2 Burrows Terrace,Tamuning-Tumon-Harmon Village,142,6,756235,2020-12-19 23:27:07
542,ante ipsum primis in faucibus orci luctus et,05 Nova Terrace,Kinlough,1998,4,556203,2020-07-09 06:45:58
543,primis in faucibus orci luctus et ultrices,61 Pine View Drive,Dziergowice,967,4,539151,2021-03-08 21:23:26
544,semper interdum mauris ullamcorper purus sit,417 Kings Road,Gunungtua,391,10,297159,2020-12-07 01:23:18
545,quam turpis adipiscing lorem vitae mattis,3 Florence Way,Qiuchuan,639,9,461574,2021-05-16 07:30:05
546,duis bibendum morbi non quam nec dui luctus,677 Lyons Alley,Loukísia,377,5,298364,2020-11-20 01:33:27
547,purus eu magna vulputate,1749 Luster Circle,Tilburg,755,7,139874,2020-09-20 04:41:31
548,non mauris morbi non lectus,9 Troy Point,Batusangkar,207,1,782272,2020-11-02 19:22:54
549,dictumst aliquam augue quam sollicitudin vitae consectetuer eget,210 Weeping Birch Court,Dzerzhinskiy,326,9,321280,2021-04-10 12:22:52
550,nulla ultrices aliquet maecenas leo odio,1741 4th Court,Mevo horon,565,3,203737,2020-07-17 10:27:43
551,elit ac nulla sed vel enim sit amet,4983 Northwestern Park,Blobo,1355,8,370984,2020-09-06 19:17:40
552,erat tortor sollicitudin mi sit amet,9 American Ash Place,Horní Lideč,786,9,303252,2020-11-24 23:10:09
553,suscipit a feugiat et eros vestibulum,79 Spohn Avenue,Waeng Yai,1029,4,419303,2020-12-17 19:49:46
554,iaculis diam erat,1 Reinke Court,Al Metlaoui,1268,6,208683,2020-07-10 06:07:03
555,a libero nam dui proin,998 Maryland Crossing,Palmeiros,973,4,752197,2020-05-17 16:44:12
556,ut at dolor quis odio consequat,95 Buena Vista Parkway,Eshowe,290,8,587555,2020-12-15 10:38:07
557,luctus et ultrices,2390 Transport Plaza,Dake,1947,4,293901,2020-10-02 19:57:16
558,vivamus vel nulla eget eros elementum,6561 Hagan Point,Oued Zem,1039,8,647989,2020-12-04 02:22:11
559,viverra dapibus nulla suscipit ligula,0 Eggendart Junction,Omsukchan,1144,6,35296,2020-07-30 02:39:42
560,pulvinar nulla pede ullamcorper,86938 Loftsgordon Parkway,Arrah,1345,2,684859,2020-11-08 12:42:43
561,dolor quis odio consequat varius integer ac,1325 Old Gate Alley,Krajan Demit,537,6,810411,2020-06-04 18:47:24
562,vel augue vestibulum rutrum rutrum neque aenean auctor,8163 Karstens Way,La Guadalupe,1900,10,772211,2020-08-22 16:08:26
563,nulla ac enim in,93891 Sunnyside Hill,Daba,1552,2,780848,2021-01-31 07:14:53
564,ultrices mattis odio donec vitae nisi nam,1765 Logan Road,Kveda Chkhorots’q’u,263,10,570976,2020-11-06 23:01:34
565,ligula in lacus curabitur at ipsum ac,4 Brown Junction,Yakovlevskoye,1577,10,774150,2020-09-14 15:44:15
566,dictumst aliquam augue quam sollicitudin,115 Boyd Point,Bandarlampung,125,4,388364,2021-04-27 20:49:22
567,non mauris morbi non lectus aliquam,03 Ridgeview Trail,Pajić Polje,959,3,47802,2021-02-02 05:45:28
568,ut at dolor quis odio,4954 Schlimgen Park,Korhogo,299,4,732614,2020-12-10 03:17:54
569,iaculis congue vivamus metus arcu adipiscing molestie,02 Dovetail Lane,Lameiro,689,8,958695,2020-07-20 17:44:54
570,nulla suscipit ligula in lacus curabitur at ipsum,434 Hudson Place,Bilo,978,6,204406,2021-01-05 14:29:21
571,suspendisse potenti cras in purus,307 Dryden Parkway,Petrovsk,1143,10,673862,2020-12-17 08:34:37
572,in quam fringilla rhoncus mauris,1 Shopko Court,Karinë,82,6,488477,2021-05-15 03:09:22
573,duis mattis egestas,5 International Street,Kamionka Strumitowa,1486,2,200913,2021-03-18 11:27:11
574,in tempus sit amet sem,15184 Pond Road,Hartford,1985,6,641551,2020-06-12 05:54:56
575,magnis dis parturient montes nascetur ridiculus mus vivamus,094 Roth Street,Agen,1459,6,11538,2021-04-06 16:26:55
576,congue etiam justo etiam pretium iaculis justo,9000 Maple Circle,Yangjiao,1682,4,927833,2020-12-15 04:10:25
577,ultrices posuere cubilia curae mauris viverra,91362 Moulton Trail,Kuala Lumpur,1373,6,453153,2021-01-17 10:55:47
578,penatibus et magnis dis parturient,9 Mallard Avenue,Uchaly,539,5,706311,2021-01-20 16:35:05
579,ultrices erat tortor sollicitudin mi sit amet,57594 Weeping Birch Junction,Ejmiatsin,1281,3,507437,2020-11-11 21:20:52
580,at turpis donec posuere metus vitae,57 Clarendon Drive,Aix-en-Provence,1205,4,348731,2020-11-28 04:22:45
581,nunc rhoncus dui,196 Pearson Drive,Ríohacha,1222,7,457711,2020-07-20 22:46:34
582,sapien a libero,0 Scofield Trail,Sanxing,1337,5,152246,2021-01-16 05:42:48
583,at dolor quis odio consequat varius integer ac,34535 Nancy Court,Yinhedahan’er,1923,2,826908,2021-02-27 10:07:03
584,nulla neque libero convallis,02 Grasskamp Pass,Ar Raqqah,1959,6,511206,2020-10-27 14:39:57
585,nulla facilisi cras non velit nec nisi vulputate,3 Grover Plaza,San Francisco,742,4,866498,2020-09-18 21:32:57
586,luctus nec molestie sed justo,5538 Florence Avenue,Zwolle,1749,9,750930,2020-10-16 19:08:51
587,diam id ornare,85 Dakota Court,Casigua El Cubo,1517,8,452178,2021-01-10 12:24:03
588,volutpat sapien arcu sed,442 Debra Lane,Ciudian,1485,1,343431,2021-05-15 13:43:01
589,porttitor pede justo eu massa donec dapibus,557 Grover Circle,Tuatuka,1449,8,870972,2020-10-15 20:39:32
590,ipsum praesent blandit lacinia erat vestibulum,01 Badeau Court,Nieying,588,10,914016,2021-04-07 03:49:10
591,habitasse platea dictumst,83 Bluejay Parkway,Almirante,808,6,424495,2020-08-27 21:24:15
592,ante nulla justo aliquam quis turpis,2 Longview Avenue,Traiguén,947,3,518201,2020-12-01 00:37:48
593,donec odio justo sollicitudin ut suscipit,77 Artisan Hill,Sobotín,886,8,491434,2020-12-14 17:14:39
594,imperdiet sapien urna pretium nisl ut volutpat,4283 Melvin Road,Lapinjärvi,1595,2,640068,2020-10-07 04:32:08
595,sit amet turpis elementum ligula vehicula,3 Mallard Drive,Samannūd,91,6,272604,2021-01-10 05:08:23
596,et ultrices posuere cubilia curae donec pharetra,6 Old Shore Center,San Alejandro,826,5,479485,2020-09-07 17:33:05
597,pede lobortis ligula sit,84209 Caliangt Avenue,Binabaan,115,3,299750,2021-02-04 06:57:35
598,et tempus semper,602 Summerview Terrace,Crateús,1855,4,860305,2021-01-26 09:29:41
599,ligula nec sem,3803 Schlimgen Trail,København,1813,1,984773,2021-04-29 15:23:28
600,nisl duis ac nibh,03 Monument Center,Bayanaūyl,1271,5,168165,2020-11-29 10:12:52
601,imperdiet et commodo vulputate justo,8 Fremont Drive,Zhongchuan,360,3,591970,2020-08-06 09:51:26
602,id nisl venenatis lacinia,15326 Calypso Trail,Vesoul,740,9,666648,2021-03-03 03:48:35
603,ligula pellentesque ultrices phasellus id sapien in sapien,2467 Almo Pass,Bardiyā,271,2,975255,2020-09-01 08:46:53
604,condimentum id luctus nec molestie sed justo pellentesque,58456 Shopko Point,Płońsk,435,4,414239,2021-05-03 13:42:42
605,nisl duis bibendum felis sed interdum venenatis,4 American Place,Bukabu,866,6,995448,2021-04-28 19:30:49
606,nam congue risus semper porta,02 Manley Point,Nova Varoš,200,3,754614,2021-03-05 23:41:12
607,sed nisl nunc rhoncus dui vel sem sed,676 Bultman Parkway,Kalate,349,5,109430,2020-10-31 20:04:50
608,pede malesuada in,76778 Crownhardt Park,Monte Novo,1077,5,867313,2020-06-12 00:55:47
609,porttitor lacus at turpis donec posuere metus vitae,31296 Becker Alley,Dagang,1404,6,277854,2021-04-29 19:30:49
610,mollis molestie lorem,054 Raven Lane,Vilque Chico,1170,9,106618,2020-08-23 00:05:13
611,mus etiam vel augue vestibulum rutrum rutrum,0682 Ilene Trail,Jiangcun,771,5,807252,2020-08-24 10:52:51
612,vitae mattis nibh ligula nec sem duis aliquam,84 Waywood Terrace,Puncaksari,245,4,144726,2021-05-02 16:04:58
613,nascetur ridiculus mus etiam,75077 Holmberg Pass,Rennes,659,7,255493,2020-07-13 16:45:56
614,et magnis dis parturient montes nascetur ridiculus mus,3548 Green Ridge Avenue,Chistopol’,1777,6,63563,2020-07-24 03:39:26
615,nulla integer pede justo lacinia,413 Sutteridge Park,Jinshi,1045,1,402769,2020-10-23 01:59:01
616,in est risus auctor sed,7 Butternut Pass,Bandarbeyla,423,10,533023,2020-07-21 13:38:47
617,ultrices mattis odio donec vitae nisi,09384 Burning Wood Crossing,Progreso,525,3,898515,2020-08-23 19:18:11
618,accumsan tellus nisi,52 Nova Pass,"Palmas De Gran Canaria, Las",1781,3,617220,2021-01-28 13:47:02
619,odio cras mi pede malesuada in,9 Bartillon Pass,Versailles,261,6,482029,2020-07-26 07:13:26
620,tortor risus dapibus augue vel accumsan tellus,55 Westport Street,Xinmin,1080,3,365280,2020-07-21 05:57:11
621,volutpat sapien arcu,30159 Muir Alley,Abastumani,1753,5,598761,2020-10-06 23:21:10
622,sed ante vivamus tortor,42655 Arapahoe Court,Tengah,1070,10,402009,2020-05-18 03:48:44
623,phasellus in felis donec,706 Coleman Parkway,São Miguel de Machede,360,8,281778,2020-09-26 12:57:38
624,amet consectetuer adipiscing elit proin,13 Park Meadow Drive,Srinjine,446,7,6313,2020-12-21 18:43:43
625,augue vestibulum ante,5235 Magdeline Drive,Korolevo,1503,8,672087,2021-01-01 08:46:05
626,fusce consequat nulla,369 Gale Point,Senneterre,826,5,120538,2021-01-19 18:12:27
627,orci vehicula condimentum curabitur,030 Oakridge Park,Novosibirsk,1627,4,396039,2020-05-29 23:52:55
628,eget tempus vel pede morbi porttitor lorem,0880 Kenwood Plaza,Erba,1740,2,417308,2020-11-20 06:02:37
629,diam in magna bibendum imperdiet,4 Bunker Hill Crossing,Donnybrook,1967,8,880031,2021-05-03 17:32:03
630,et commodo vulputate justo in blandit ultrices,94 Anzinger Point,Xiaodukou,1833,1,28469,2020-12-06 23:33:04
631,amet eleifend pede libero quis orci nullam,86 Annamark Center,Wuluhan,1047,3,781977,2021-04-08 16:53:45
632,quam turpis adipiscing,7 Schmedeman Pass,Kota Bharu,473,1,967984,2021-02-24 00:18:21
633,consequat dui nec nisi volutpat eleifend,141 Weeping Birch Park,Las Lajas,1166,9,34870,2021-02-20 03:41:06
634,semper est quam pharetra magna ac consequat,6 Blaine Park,Boston,464,5,514372,2020-06-11 03:22:59
635,aliquam non mauris morbi,64 Meadow Vale Drive,Sundre,1240,2,569088,2020-08-27 04:28:25
636,fusce consequat nulla nisl nunc nisl duis bibendum,4 Carey Crossing,Lagawe,843,3,905400,2021-02-24 00:42:40
637,in tempus sit amet sem fusce consequat nulla,54 Badeau Center,Polanica-Zdrój,1932,4,745943,2020-08-26 02:24:08
638,duis bibendum felis sed,42270 Pond Park,Tufang,1685,10,456580,2020-11-20 03:13:48
639,platea dictumst etiam faucibus cursus urna,36450 Eagan Pass,Liudong,1085,1,366655,2020-07-19 03:36:36
640,fusce consequat nulla nisl nunc nisl duis,82587 Prairie Rose Pass,Luzhou,266,8,930924,2020-09-08 15:40:31
641,donec quis orci eget,73 Elka Center,Minuwangoda,1283,8,942314,2020-12-31 09:56:50
642,ut blandit non interdum in ante vestibulum ante,271 Armistice Terrace,Xinhua,1436,10,162020,2021-02-24 14:11:38
643,eleifend luctus ultricies,7 8th Drive,Baitian,1289,4,305948,2020-11-08 12:06:03
644,pellentesque at nulla suspendisse potenti cras in,5394 Donald Pass,Czechowice-Dziedzice,890,8,814805,2020-11-10 14:03:33
645,in imperdiet et commodo vulputate,02664 Del Sol Hill,Ban Pong,258,7,596282,2021-04-27 13:02:09
646,sed sagittis nam congue risus semper porta,39659 Upham Hill,Strezhevoy,1782,8,723053,2020-09-01 06:17:07
647,nulla suscipit ligula in lacus curabitur,91 Maywood Pass,Trashigang,245,2,653775,2020-06-15 06:36:36
648,augue a suscipit nulla elit ac nulla sed,0 Oak Trail,Bor,96,8,889374,2021-04-15 05:32:04
649,eros viverra eget,18705 West Court,Rabah,888,1,662525,2021-02-27 10:57:00
650,mauris morbi non lectus aliquam,7160 Myrtle Hill,Shiling,598,8,791822,2020-07-07 14:49:41
651,vitae mattis nibh,0973 Arkansas Hill,Xinhe,1394,2,555225,2021-02-21 19:11:52
652,nisl nunc nisl duis,781 Bonner Crossing,Xinshan,1439,9,351116,2020-12-10 13:12:25
653,etiam justo etiam,73 1st Parkway,Libušín,1169,9,892673,2021-05-22 00:55:17
654,orci luctus et ultrices posuere cubilia,8539 Cardinal Pass,Hokor,1244,10,436003,2021-04-03 16:52:44
655,vel sem sed sagittis nam congue risus,38 Debra Way,Mpraeso,572,8,571158,2020-06-14 20:04:50
656,semper sapien a libero,8 Moose Alley,Lishu,1372,3,268379,2020-08-18 00:55:21
657,nibh in quis justo maecenas,49587 Haas Park,Troparëvo,856,10,308870,2021-01-09 03:32:28
658,ligula suspendisse ornare consequat lectus,88 Texas Trail,Villa Dolores,558,1,219100,2020-05-25 17:39:56
659,pellentesque ultrices phasellus,06152 Lyons Way,Calape,1161,3,619435,2021-04-09 23:34:56
660,consequat ut nulla,5998 Amoth Terrace,Klos,336,9,551222,2020-11-02 21:55:58
661,ut erat curabitur gravida nisi at nibh in,86 Meadow Ridge Way,Khust,1503,4,391955,2020-07-07 11:15:40
662,magna vestibulum aliquet,3 Surrey Crossing,Nijmegen,290,2,370782,2020-08-01 14:14:00
663,lobortis vel dapibus at diam,57 Declaration Alley,Naagas,74,3,837153,2020-06-03 04:20:57
664,quis libero nullam sit,5245 Steensland Lane,Perpignan,1267,5,489284,2020-11-27 21:49:04
665,morbi sem mauris laoreet ut rhoncus,5510 Springview Circle,Phra Yuen,330,1,511626,2020-06-16 22:30:22
666,viverra pede ac diam cras,75 Esker Terrace,Rostov-na-Donu,876,3,982756,2020-10-12 02:23:59
667,magnis dis parturient montes nascetur ridiculus,3051 Springview Crossing,Perelhal,1846,10,718225,2020-06-05 06:34:08
668,odio condimentum id luctus nec molestie sed justo,7 Marquette Avenue,Ivano-Frankove,1774,8,1269,2020-10-27 15:15:13
669,blandit mi in porttitor,57 Morningstar Avenue,Votorantim,658,6,305935,2020-10-26 15:05:25
670,eget massa tempor convallis nulla neque,93030 Service Center,Vindeln,315,2,678136,2020-11-05 22:43:38
671,aliquet maecenas leo,5 Portage Center,E’erdun Wula,999,6,294982,2020-08-07 10:10:00
672,lacinia sapien quis libero nullam sit amet turpis,915 Superior Crossing,Rodatychi,76,2,894368,2021-01-06 23:16:54
673,elementum nullam varius nulla facilisi,11880 Merrick Junction,Memphis,678,4,941011,2021-01-23 02:53:53
674,at nunc commodo,249 Drewry Center,Santa Bernardina,676,3,345231,2020-10-09 10:19:40
675,mattis egestas metus aenean fermentum,4486 Bayside Way,Sukasetia,1770,4,49315,2020-10-16 11:24:04
676,ut at dolor quis,14 Mifflin Trail,Filabusi,165,10,433682,2020-07-22 08:30:58
677,scelerisque quam turpis adipiscing lorem vitae mattis nibh,64035 Mallory Junction,Creighton,1106,1,607446,2020-12-25 07:21:58
678,hac habitasse platea dictumst etiam,3 Ronald Regan Street,Jinfeng,34,7,401088,2020-11-07 11:43:45
679,et commodo vulputate,38808 Northwestern Street,Aqtaū,111,1,696996,2020-11-06 07:55:13
680,sed accumsan felis ut at,77709 Maryland Crossing,Ruy Barbosa,803,5,723067,2021-03-19 23:45:00
681,nulla neque libero convallis eget,82507 Arkansas Lane,Vitoria-Gasteiz,1032,10,109581,2021-02-19 16:54:35
682,cursus id turpis integer aliquet massa,2 Nobel Drive,Figueiras,1905,2,191314,2020-07-30 22:32:49
683,cras mi pede malesuada in imperdiet,3890 Lerdahl Pass,Nîmes,779,9,137156,2020-11-26 15:58:02
684,elit proin risus praesent lectus,9396 Graceland Trail,Escazú,643,8,548481,2020-12-25 09:00:48
685,purus eu magna,6 Havey Lane,Ibaraki,1405,2,724909,2021-03-22 13:24:59
686,libero ut massa,598 Ohio Terrace,Balete,212,1,185143,2021-01-13 10:55:26
687,amet cursus id turpis integer aliquet,86 Dwight Lane,Xinmen,1653,1,982058,2021-01-20 09:07:36
688,proin interdum mauris,2923 Merry Park,Plomárion,1595,8,61899,2021-04-27 02:09:59
689,sodales sed tincidunt eu felis,70198 Fisk Hill,Wenhe,155,4,173163,2020-09-14 04:42:16
690,mauris enim leo rhoncus,9743 Sommers Parkway,Dallas,834,4,226249,2020-08-27 00:27:59
691,risus semper porta volutpat,6551 Helena Road,Magnitka,218,2,838065,2021-01-27 23:03:53
692,adipiscing molestie hendrerit at vulputate vitae nisl,0572 Charing Cross Alley,Los Angeles,1434,9,818848,2020-12-07 22:45:09
693,mattis nibh ligula,6 Clemons Crossing,Boulemane,663,5,630384,2021-01-20 19:02:52
694,vel augue vestibulum rutrum rutrum,1829 American Street,Bayonne,1741,5,897080,2020-12-13 21:07:53
695,magnis dis parturient,4690 Sachs Park,Ayabe,942,1,243426,2020-06-02 10:25:19
696,porta volutpat erat quisque erat eros viverra eget,40021 Springs Circle,Sukamenak,89,10,864933,2020-09-23 00:04:32
697,leo maecenas pulvinar lobortis est phasellus sit,5225 Hermina Street,Podsineye,932,9,401302,2021-03-10 05:43:38
698,imperdiet sapien urna pretium nisl ut volutpat sapien,3 Carey Drive,Gonghe,535,5,363620,2021-04-24 15:16:54
699,mattis egestas metus aenean fermentum donec,70 Derek Park,Duut,1672,5,822037,2020-09-03 07:30:44
700,eros vestibulum ac est lacinia nisi venenatis,6 Eggendart Circle,Chowṉêy,963,3,869455,2020-06-08 14:11:20
701,ultrices posuere cubilia,8 Golf Course Trail,Jilma,865,5,616281,2020-11-19 03:19:18
702,dapibus at diam nam,23 Lotheville Lane,Sagasa,1197,8,779787,2020-12-11 12:33:43
703,ornare imperdiet sapien urna pretium,8 Sunfield Junction,Dem’yanovo,1153,10,948350,2020-06-16 06:19:21
704,morbi non lectus aliquam sit,2 Center Place,Guantouzui,541,2,568916,2021-04-02 16:25:03
705,erat fermentum justo nec,82743 Forest Run Street,Berbek,212,10,245505,2020-12-20 02:31:24
706,sed vestibulum sit amet cursus id,1 Esch Court,Lesichevo,772,6,985584,2021-02-23 18:52:15
707,eget tincidunt eget tempus vel pede morbi,682 Independence Junction,Drohiczyn,1388,9,571604,2021-01-15 01:27:40
708,molestie sed justo,89302 Nancy Parkway,Lusacan,288,1,400601,2020-06-06 23:19:25
709,sit amet nulla quisque,31 Northridge Hill,Tampakan,555,5,340954,2020-11-11 09:53:10
710,est lacinia nisi venenatis tristique fusce,5864 Corry Junction,Angers,1191,9,17798,2020-06-11 03:56:22
711,justo eu massa donec dapibus duis at,6 Grasskamp Parkway,Zafar,631,3,180566,2021-01-30 20:12:44
712,vel augue vestibulum ante,012 Harper Pass,Maodian,983,1,733792,2021-04-08 17:22:23
713,nunc donec quis orci,625 Marcy Parkway,Guamal,1119,3,932815,2021-03-05 23:30:07
714,in faucibus orci,141 Moulton Hill,Si Racha,138,7,916422,2021-02-09 21:28:50
715,lacinia eget tincidunt eget tempus vel,7 Nelson Plaza,Mramani,930,7,906292,2020-09-13 02:23:38
716,erat vestibulum sed magna,09530 Green Ridge Road,Vaitape,1591,2,594827,2020-11-16 17:14:50
717,in ante vestibulum ante ipsum primis in,744 Thompson Hill,Denver,854,10,663362,2020-09-13 05:16:56
718,sed magna at nunc commodo placerat praesent blandit,145 Amoth Alley,Santaluz,958,3,641295,2020-08-20 17:54:08
719,imperdiet et commodo vulputate justo in blandit ultrices,9732 Monument Center,Makueni,291,9,420806,2020-10-24 12:12:23
720,duis aliquam convallis nunc proin at,25 Springs Terrace,Gunung Sugih,1606,10,969844,2020-06-16 02:58:42
721,justo sollicitudin ut suscipit,965 Gateway Way,Guanghou,1431,6,752595,2020-07-27 12:14:26
722,dui vel nisl,480 Johnson Junction,Mor Laok,506,1,334459,2020-09-30 19:32:20
723,pharetra magna vestibulum aliquet ultrices,40 Monument Pass,Gaocang,980,1,233833,2021-02-11 10:17:15
724,nulla integer pede justo lacinia eget tincidunt eget,19 Towne Pass,Krasnogorskoye,256,5,74703,2020-07-23 06:11:48
725,augue a suscipit nulla elit ac nulla sed,19368 Blue Bill Park Junction,Speightstown,1185,10,334921,2021-02-09 08:23:57
726,vestibulum quam sapien varius,6041 Sage Alley,Ageoshimo,514,1,846889,2020-08-14 16:33:46
727,interdum in ante,2 Dakota Way,Lauro de Freitas,1714,10,979594,2021-05-14 02:11:10
728,sollicitudin ut suscipit a feugiat et,76945 La Follette Lane,Cijoho,651,3,847164,2020-07-13 16:31:41
729,odio in hac habitasse platea dictumst maecenas ut,848 Hintze Parkway,Thaba Nchu,1127,7,880782,2020-11-08 23:28:43
730,at turpis a pede posuere nonummy integer,34450 Petterle Avenue,San Antonio,1582,6,181053,2021-05-01 11:20:10
731,tellus semper interdum,014 Dennis Plaza,Gunungmalang Satu,148,1,704103,2020-09-21 20:15:29
732,quis justo maecenas rhoncus aliquam,9534 Pennsylvania Terrace,Tai’an,1244,8,185140,2021-04-26 12:01:52
733,risus semper porta,6 Ridge Oak Plaza,Vitória da Conquista,670,4,795688,2021-03-24 01:05:49
734,habitasse platea dictumst morbi,2142 Forest Run Alley,Chuhuyiv,1412,2,606199,2020-12-15 16:57:38
735,consequat morbi a ipsum integer a nibh,39165 Hagan Court,Santa Ana Huista,282,5,293595,2020-08-22 20:00:13
736,faucibus orci luctus et ultrices posuere cubilia,9 5th Plaza,Cerna,27,4,355220,2020-06-08 18:04:35
737,habitasse platea dictumst maecenas ut,63742 Mccormick Alley,Tisul’,1933,6,160572,2021-02-18 00:21:12
738,magnis dis parturient montes,375 Browning Center,Larache,1709,3,86760,2021-03-02 13:54:13
739,odio elementum eu interdum eu tincidunt in leo,0768 Northwestern Alley,Oele,256,6,581302,2020-07-29 01:09:09
740,sem mauris laoreet ut,9 Tennyson Lane,Caaguazú,984,8,361519,2021-03-30 04:07:19
741,odio donec vitae nisi nam ultrices libero,9 Bartillon Street,Lisakovsk,483,9,884505,2021-05-22 00:45:11
742,duis faucibus accumsan odio curabitur convallis duis consequat,563 Tennessee Circle,Ignacio Zaragoza,442,10,777613,2021-03-08 07:36:03
743,tellus nisi eu orci mauris lacinia sapien quis,4 Burrows Crossing,Verkhnyaya Khava,1176,7,480564,2021-02-06 07:42:35
744,volutpat in congue etiam justo etiam,42901 Sachtjen Lane,Moussoro,1690,4,942975,2021-03-06 15:07:07
745,fusce congue diam id ornare imperdiet,20 Killdeer Avenue,Cabanbanan,1138,6,508336,2020-09-22 06:31:27
746,vivamus metus arcu,1 Londonderry Way,Changzhi,1656,4,576091,2020-12-02 17:40:25
747,pede justo lacinia eget tincidunt eget tempus,4 Holmberg Alley,Hejiang,1002,10,847455,2020-12-09 15:12:28
748,primis in faucibus orci luctus et,007 Upham Point,Bāglung,1565,7,108177,2021-04-26 05:49:39
749,praesent blandit lacinia erat vestibulum sed magna at,20333 Shasta Drive,Resplendor,1074,8,341212,2020-10-09 05:31:48
750,nunc proin at turpis,0487 Park Meadow Plaza,Dowsk,1005,9,522843,2020-06-17 13:59:35
751,porttitor pede justo eu massa donec dapibus,41867 Starling Place,Las Tablas,489,2,412924,2021-05-13 00:00:52
752,vel pede morbi porttitor lorem id,6 Myrtle Trail,Järfälla,1694,9,526174,2020-12-20 07:52:37
753,non velit donec,93722 Milwaukee Lane,Liuzhuang,1946,9,511257,2020-07-06 14:34:14
754,vehicula condimentum curabitur in libero ut,036 Bluejay Parkway,Peremyshl’,1474,7,372320,2020-05-28 07:28:10
755,sit amet lobortis sapien sapien non,5 Arrowood Crossing,Kislyakovskaya,1840,5,262754,2020-07-16 20:15:01
756,odio justo sollicitudin ut suscipit,546 Michigan Place,Babakankalong,1880,2,447140,2020-11-27 17:31:16
757,quisque porta volutpat erat quisque erat eros,8 Grasskamp Terrace,Göteborg,1489,9,494612,2020-10-31 20:05:37
758,nam ultrices libero,4318 Talmadge Road,Launceston,124,10,954075,2020-06-30 15:52:40
759,pellentesque ultrices mattis odio donec vitae nisi nam,44875 Merry Court,Chancay,1676,9,741161,2020-05-21 09:02:44
760,amet diam in magna bibendum,5 Coleman Junction,Batsari,1554,5,679628,2020-12-02 19:02:02
