256,ante vestibulum ante ipsum,9514 Coolidge Place,Thị Trấn Nga Sơn,131,6,770566,2020-05-20 21:22:19
257,in est risus auctor sed tristique in,27 Talisman Place,Polo,1949,3,311032,2021-04-18 22:06:34
258,fusce congue diam id ornare imperdiet sapien urna,7 Gateway Point,Pategi,1537,9,479755,2021-04-21 22:13:22
259,libero quis orci nullam molestie nibh in lectus,28054 Laurel Court,Malax,252,9,910773,2020-06-07 23:24:07
260,pulvinar nulla pede ullamcorper augue a,642 Tony Plaza,Czechowice-Dziedzice,1714,6,126373,2020-07-12 06:55:15
261,elementum pellentesque quisque,3 Melrose Circle,Cherëmushki,352,3,384302,2020-05-24 06:45:04
262,commodo vulputate justo in blandit ultrices enim lorem,344 Sachs Park,Aghavnatun,288,1,112411,2020-07-11 10:21:07
263,scelerisque mauris sit amet eros suspendisse accumsan tortor,3833 Darwin Center,Ostružnica,1937,5,716042,2020-08-20 03:17:11
264,tincidunt nulla mollis molestie lorem,1358 Springs Trail,Kadubadak,234,3,868818,2021-01-15 20:12:09
265,venenatis non sodales sed,4982 Meadow Vale Way,Mjölby,937,10,278573,2021-03-06 03:58:15
266,auctor gravida sem praesent id massa id nisl,7 Burrows Road,Aguadas,1189,1,690914,2021-03-24 23:14:23
267,tempus vel pede morbi porttitor lorem id ligula,03 Westend Trail,Shunde,916,6,980215,2021-04-27 04:34:38
268,tempus sit amet sem fusce consequat nulla,9067 Kim Crossing,Quilmaná,206,5,645330,2021-03-27 11:20:40
269,accumsan tellus nisi eu orci mauris lacinia,3 Tomscot Road,Czarna Białostocka,1286,8,442843,2020-07-22 08:03:45
270,arcu sed augue aliquam erat volutpat,14018 Arkansas Way,Māmūnīyeh,1881,1,67260,2020-11-23 01:43:26
271,pede justo eu massa donec,7143 Northport Park,Libenge,250,9,799935,2020-10-22 00:03:56
272,justo in hac habitasse platea dictumst etiam,64659 Springs Center,Longxi,216,9,157345,2021-01-31 08:09:31
273,sed magna at nunc commodo placerat praesent blandit,16269 Kensington Trail,Neikeng,783,6,711786,2021-02-28 10:40:24
274,at velit eu est,03 Anthes Street,Lokuuy,1676,2,405616,2020-07-28 16:03:32
275,sed tincidunt eu felis fusce posuere felis sed,0 Veith Park,Pietermaritzburg,433,1,975400,2020-09-27 15:38:02
276,vel sem sed sagittis nam congue risus semper,29632 Ridgeview Lane,Volovets,688,5,396442,2020-07-02 12:51:23
277,eget eros elementum pellentesque quisque,36021 Florence Center,Requião,882,7,139610,2020-10-30 22:51:56
278,nulla facilisi cras non velit nec nisi,60 Annamark Parkway,Dachong,1209,9,795767,2020-11-03 09:06:53
279,lacinia erat vestibulum sed magna at nunc commodo,479 Bluejay Place,Baqiu,1943,8,54214,2020-12-06 08:48:21
280,consequat metus sapien ut nunc vestibulum ante,54 Brown Terrace,Blang Dalam,1447,4,508924,2020-06-14 09:50:23
281,sit amet sem,64611 International Place,Yeşilköy,1547,9,130969,2020-11-23 09:26:15
282,in tempus sit amet sem fusce consequat,77629 Dennis Pass,Suhong,1828,9,368789,2020-05-19 08:05:41
283,condimentum neque sapien placerat ante nulla,0921 Roxbury Pass,Isfana,963,4,130099,2020-07-17 03:50:54
284,ultrices erat tortor sollicitudin mi sit amet lobortis,5254 Glendale Alley,Marmárion,1596,10,269854,2021-02-01 08:13:39
285,nunc proin at turpis,843 Commercial Crossing,Taohuajiang,1269,8,112478,2021-01-19 11:48:33
286,nisi eu orci mauris,49 Dawn Lane,Nilanapo,1472,5,123342,2021-03-07 16:59:10
287,nunc purus phasellus in felis,6810 Lakewood Gardens Drive,Bogale,759,4,719068,2021-04-05 18:49:02
288,tortor id nulla ultrices aliquet maecenas,5 Transport Park,El Pardo,351,3,414831,2021-03-16 08:19:34
289,pulvinar lobortis est phasellus sit amet erat nulla,5 Hermina Junction,Winong,64,10,481625,2021-01-03 22:58:34
290,erat quisque erat eros viverra eget congue,2 Westridge Park,Arcos de Valdevez,1120,3,796690,2021-02-01 19:29:51
291,posuere metus vitae ipsum aliquam non,703 Crownhardt Drive,Ping’an,145,1,107060,2020-08-18 14:40:50
292,semper sapien a,03926 Kingsford Place,Sanshan,766,3,867767,2020-11-08 12:50:27
293,venenatis lacinia aenean sit amet justo morbi ut,2 Declaration Court,Dijon,1644,10,183927,2020-10-30 20:37:56
294,in faucibus orci luctus,32280 Novick Crossing,Zhangtan,238,8,814877,2021-01-03 11:57:55
295,aliquet pulvinar sed nisl nunc rhoncus dui,41457 Monument Junction,Fushun,1461,1,432211,2020-05-28 00:48:43
296,vitae ipsum aliquam non,2 American Way,Putre,754,10,704046,2020-11-18 18:34:12
297,curae donec pharetra magna,075 Quincy Junction,Zushi,727,1,731269,2020-11-14 09:20:03
298,dolor sit amet consectetuer adipiscing,93 Doe Crossing Avenue,Kebon,1753,7,602455,2020-08-05 18:44:36
299,ligula in lacus curabitur at,2227 Pawling Way,Mineiros,230,6,494060,2020-10-27 16:07:53
300,vulputate ut ultrices vel augue vestibulum ante,02 Eagle Crest Court,Tromsø,131,2,443790,2020-07-17 14:18:15
301,lacus purus aliquet at feugiat non pretium quis,41811 Memorial Crossing,Dvorichna,1574,10,606827,2020-07-26 13:22:12
302,pede lobortis ligula sit,3 Ronald Regan Drive,Siqian,1558,4,994002,2020-08-16 13:23:26
303,nulla integer pede justo lacinia eget tincidunt eget,87107 Clarendon Trail,Hushi,1208,4,4314,2020-10-10 07:55:14
304,commodo placerat praesent blandit nam nulla,43 Union Parkway,Montalegre,1156,2,100737,2020-09-28 19:27:15
305,in tempus sit amet sem fusce,08 Westport Terrace,Fray Bentos,473,9,937412,2021-01-29 03:57:30
306,felis fusce posuere felis sed lacus morbi,15256 Chinook Center,Caburan,515,10,754713,2021-04-26 18:07:17
307,bibendum imperdiet nullam orci pede venenatis non,5824 Bonner Hill,Gala,657,4,81989,2020-09-17 07:09:00
308,turpis integer aliquet,1 Columbus Plaza,Teberda,938,4,43691,2021-03-07 12:39:37
309,purus eu magna vulputate luctus cum sociis,70057 Almo Circle,Jongīyeh,1005,10,368201,2020-11-15 14:34:25
310,in lectus pellentesque at nulla suspendisse potenti,9 Ronald Regan Court,Ingå,1922,5,645467,2021-04-07 07:20:26
311,iaculis congue vivamus metus,432 Leroy Road,Kréstena,947,5,67922,2020-10-14 12:10:51
312,eget eleifend luctus ultricies eu nibh quisque id,29 Novick Drive,Ipís,1332,8,239000,2020-06-24 16:23:15
313,congue diam id ornare imperdiet sapien urna,40871 Coolidge Point,Osasco,692,10,892004,2020-12-23 21:13:13
314,sed nisl nunc rhoncus dui vel,98 Donald Plaza,Huajialing,432,1,115627,2021-03-21 19:50:54
315,sit amet consectetuer adipiscing,2 Johnson Place,Lukovë,320,8,799482,2020-12-25 09:47:44
316,aenean lectus pellentesque eget nunc donec,38645 Elmside Road,Rantaupanjang,484,8,493135,2020-10-14 23:29:19
317,rhoncus mauris enim leo rhoncus sed,119 Scofield Lane,Farmahīn,663,1,733657,2021-04-01 01:17:56
318,ut mauris eget massa,98495 Spaight Way,Zaindainxoi,721,9,940615,2020-12-31 00:59:24
319,ligula nec sem duis aliquam convallis,8906 Mccormick Point,Cocorná,1646,6,79288,2021-02-21 18:38:27
320,consequat in consequat ut nulla sed,4 Declaration Court,Sabtang,271,10,404387,2020-05-18 15:57:29
321,vel augue vestibulum ante ipsum,840 Debs Center,Carrascal,812,8,11202,2020-11-23 06:17:44
322,lectus aliquam sit amet diam in magna bibendum,27 Dakota Trail,Badāmā,1646,7,973363,2021-05-14 01:18:14
323,id lobortis convallis tortor risus,5 Sycamore Court,Mandala,318,3,106108,2021-04-25 00:49:26
324,nec nisi vulputate nonummy maecenas,1779 Morning Drive,Gibgos,1512,1,284804,2020-11-03 23:35:29
325,ac enim in tempor turpis nec euismod,892 Bobwhite Circle,Makhalino,252,5,582754,2021-01-06 22:55:19
326,morbi quis tortor id nulla ultrices aliquet maecenas,891 Badeau Terrace,Farinheiras,1836,1,643195,2020-06-12 23:49:39
327,lorem quisque ut erat curabitur gravida nisi at,38 Schmedeman Point,Anchang,1377,8,289777,2021-04-21 20:12:17
328,arcu sed augue,61467 Petterle Trail,Jambeyan,1017,5,221975,2020-09-29 09:01:34
329,curabitur at ipsum,49 Eagle Crest Place,Xianyi,1870,4,438911,2020-08-22 06:43:26
330,tortor duis mattis egestas metus aenean,81 Westridge Lane,Linxi,55,4,914423,2020-12-05 20:38:48
331,suscipit ligula in lacus curabitur at ipsum ac,496 Emmet Trail,San Fernando,1431,2,6385,2020-08-21 23:53:38
332,interdum in ante,534 Marquette Point,Tabuaço,1776,9,922186,2020-10-15 04:30:24
333,nunc nisl duis bibendum felis sed interdum,2 Pennsylvania Place,Harper,1193,7,578993,2020-09-18 23:03:45
334,augue vel accumsan tellus,215 Ridge Oak Terrace,Temirgoyevskaya,359,8,824166,2021-04-09 03:54:05
335,magna at nunc commodo,8726 Rusk Court,Aoji-ri,1570,5,87613,2020-12-14 02:45:19
336,convallis nulla neque libero convallis eget,87678 Hanover Parkway,Jastrowie,395,4,24570,2021-01-04 09:18:32
337,molestie nibh in lectus,7229 Milwaukee Court,Omigawa,635,5,56220,2020-05-31 21:36:57
338,pharetra magna ac consequat,620 Roth Trail,Formosa do Rio Preto,914,4,36594,2021-05-03 22:37:28
339,erat id mauris vulputate elementum nullam varius,6 Anniversary Way,Fruitvale,303,2,743791,2021-03-10 21:45:23
340,pede ullamcorper augue a suscipit,12 Warner Circle,Blawi,31,1,128758,2020-07-13 11:21:01
341,non lectus aliquam sit amet diam in,03698 Magdeline Hill,Huyang,754,1,461993,2021-01-17 04:23:32
342,potenti nullam porttitor lacus at turpis donec,0738 Fair Oaks Park,Shimabara,53,7,234756,2020-11-05 22:37:13
343,aliquam lacus morbi quis,23 Mallory Plaza,Paola,1724,9,743754,2020-09-25 19:05:57
344,eu tincidunt in leo maecenas pulvinar,44017 Burrows Point,Pátmos,1925,8,227542,2021-02-17 11:21:38
345,enim sit amet nunc viverra dapibus nulla suscipit,851 Kipling Terrace,Vereshchagino,1199,6,297059,2021-04-12 21:43:24
346,blandit nam nulla integer,3984 Commercial Terrace,Caigangan,390,3,648418,2020-08-22 08:05:39
347,nullam sit amet turpis,7591 International Crossing,Jinhe,1251,10,147396,2020-06-16 13:37:03
348,mauris viverra diam vitae,70 Michigan Court,Toliara,135,9,460095,2021-02-01 17:16:17
349,vivamus metus arcu adipiscing molestie hendrerit,81 Holmberg Alley,Paquera,387,10,207881,2021-03-09 04:26:37
350,rutrum nulla nunc purus phasellus in felis donec,15 Toban Alley,Kui Buri,1706,2,648206,2021-01-13 00:31:17
351,accumsan tellus nisi eu orci mauris lacinia sapien,4 Anzinger Plaza,"Palmas De Gran Canaria, Las",1283,2,211217,2020-09-06 12:32:41
352,justo in blandit ultrices enim lorem ipsum,82 Drewry Center,la Massana,145,2,829857,2021-04-25 14:16:36
353,magna vestibulum aliquet,957 Troy Place,Huasta,1374,10,968198,2020-08-26 18:49:14
354,nascetur ridiculus mus,3548 Vidon Hill,Manzini,1587,3,578798,2020-09-30 03:40:22
355,augue luctus tincidunt nulla mollis molestie lorem quisque,72 Hayes Hill,Danzao,566,9,503921,2020-12-16 13:23:05
356,in leo maecenas pulvinar lobortis est phasellus,517 Lotheville Point,Zhujiatai,490,7,870827,2021-05-03 01:24:48
357,ante vestibulum ante ipsum primis in faucibus orci,042 Portage Trail,Końskowola,1322,5,796537,2021-05-13 20:05:10
358,sit amet eleifend pede libero quis orci,92 Manitowish Lane,Puerto Bello,524,2,824750,2021-01-30 14:48:10
359,vel est donec odio,25 Drewry Pass,Baltimore,1234,2,443294,2020-12-24 23:47:44
360,mauris vulputate elementum nullam varius,329 Miller Hill,Yanjiang,1054,4,197007,2021-04-02 08:25:33
361,laoreet ut rhoncus aliquet pulvinar sed,18 Milwaukee Trail,Jiuhua,1504,2,708287,2020-07-21 11:50:33
362,justo etiam pretium iaculis justo in hac habitasse,6 Becker Lane,Valera,1183,10,548036,2020-12-22 05:35:30
363,purus eu magna vulputate luctus cum sociis,48 Redwing Pass,Cayur,285,5,862506,2021-04-09 22:00:39
364,nisi eu orci mauris lacinia,4 Roxbury Circle,Starý Bohumín,390,9,704106,2020-10-25 21:09:39
365,dictumst etiam faucibus,56144 Merry Junction,Piława Górna,1195,1,96302,2021-04-18 14:00:50
366,augue vestibulum rutrum rutrum neque aenean,21 Duke Circle,Yotala,1858,2,499052,2020-08-04 01:29:12
367,curae duis faucibus accumsan odio curabitur convallis duis,59237 Sauthoff Plaza,Telêmaco Borba,1296,10,914845,2021-01-25 20:01:04
368,congue diam id ornare imperdiet sapien urna pretium,2 Lakeland Parkway,Banjar Petak,1720,10,611327,2021-03-08 21:30:12
369,ac nulla sed,76 Bluestem Road,Chixi,1922,2,72359,2020-10-30 13:12:52
370,volutpat erat quisque erat,355 Packers Place,Lille,612,1,37509,2021-04-27 18:25:32
371,augue aliquam erat volutpat in,5 Crescent Oaks Street,San Isidro,1804,5,377245,2021-04-03 19:56:24
372,maecenas ut massa quis augue,54 Arrowood Street,New York City,259,1,606359,2021-01-11 02:19:07
373,venenatis turpis enim blandit mi,9 Judy Alley,Domaniewice,648,2,919658,2021-05-08 15:33:21
374,amet consectetuer adipiscing elit proin,55 Esch Junction,Leipzig,1679,7,793116,2020-12-27 05:52:30
375,sed ante vivamus tortor duis,4 Esch Way,Fianarantsoa,306,7,538570,2020-07-06 17:04:35
376,vestibulum aliquet ultrices erat tortor sollicitudin,5 Eggendart Drive,Balucuc,1517,3,289065,2021-04-24 12:43:34
377,posuere felis sed lacus morbi,4 Heath Junction,Muraloka,930,1,470264,2020-12-19 04:27:27
378,ut odio cras mi pede malesuada in imperdiet,3803 Parkside Center,Lyambir’,69,6,632057,2021-02-07 20:18:57
379,sit amet eros suspendisse accumsan tortor quis turpis,29 Gale Center,Puerto Obaldía,1723,10,52490,2021-04-26 16:04:43
380,in congue etiam justo etiam pretium,08 Garrison Way,Karangboyo,274,9,880888,2020-07-31 12:44:53
381,eu magna vulputate luctus,7315 Moulton Road,Insua,818,1,968057,2021-04-06 08:01:28
382,egestas metus aenean fermentum donec ut mauris eget,07 Schurz Place,Qingtang,1928,2,133498,2021-05-23 21:35:34
383,sapien iaculis congue vivamus metus arcu,356 Lakeland Circle,Oslo,1164,2,325914,2020-05-17 03:58:15
384,ipsum integer a nibh in quis justo maecenas,5236 Roth Alley,Netvořice,1202,8,240021,2020-09-27 17:54:08
385,sit amet consectetuer adipiscing elit,95554 Carberry Alley,Coutada,798,1,620408,2021-01-25 04:30:23
386,potenti cras in purus,17928 Northridge Circle,Kuçovë,1531,5,787854,2020-11-16 16:37:39
387,tortor sollicitudin mi sit amet lobortis sapien,3 Jay Street,Metz,1240,2,150149,2020-06-12 20:52:03
388,dolor vel est donec odio justo sollicitudin ut,7 Hudson Alley,Studénka,1831,6,514404,2021-04-22 00:05:35
389,vel sem sed sagittis,103 Butternut Way,San Martín Zapotitlán,151,7,272617,2021-05-15 22:49:30
390,in libero ut massa volutpat convallis,839 Brown Lane,Dístomo,124,4,537176,2020-06-08 08:44:22
391,ligula in lacus curabitur at ipsum ac,94 Kenwood Hill,Žitenice,876,6,536589,2021-01-03 03:32:20
392,ipsum ac tellus semper interdum mauris ullamcorper,73 Pennsylvania Court,Novomyshastovskaya,1052,2,718872,2021-04-19 08:27:26
393,non velit nec nisi vulputate nonummy,7794 Buell Plaza,Linghu,510,4,430519,2020-10-16 09:00:05
394,quam turpis adipiscing lorem vitae,2 Badeau Street,Honglin,195,7,820927,2020-12-17 23:23:22
395,praesent blandit nam nulla integer,0320 Thackeray Pass,Ciilat,1814,5,907674,2020-09-26 16:24:39
396,dolor sit amet consectetuer adipiscing,2009 Hallows Hill,Piracuruca,1175,1,499075,2020-06-05 22:49:29
397,justo in hac habitasse,02543 Cascade Drive,Sanban,963,10,499282,2021-04-11 02:00:45
398,et ultrices posuere cubilia curae,8880 Merry Lane,Göteborg,251,9,189703,2021-01-17 23:44:34
399,ornare consequat lectus,50 Maryland Terrace,Panikian,1435,2,169160,2020-12-18 05:54:47
400,non sodales sed tincidunt eu felis fusce,1 Clove Hill,Ōmachi,1557,1,537642,2021-01-01 15:21:02
401,metus vitae ipsum aliquam non,21407 Charing Cross Parkway,Alexandria,1955,3,969705,2020-12-09 07:14:56
402,nisi nam ultrices libero,112 Oak Valley Junction,Rozvadov,1812,5,882469,2021-03-14 19:59:37
403,lectus vestibulum quam sapien varius ut blandit,7295 Huxley Point,Pampamarca,511,6,724208,2021-01-26 05:49:30
404,faucibus orci luctus et ultrices posuere,65 Comanche Avenue,Bethlehem,677,3,483508,2020-06-19 00:31:29
405,justo sit amet sapien dignissim,3 Lakeland Junction,Plakhtiyivka,811,4,629183,2021-01-23 09:10:30
406,nullam molestie nibh in lectus pellentesque,89852 Goodland Drive,Bangrat,608,1,185468,2021-04-12 10:11:59
407,quam turpis adipiscing lorem vitae mattis nibh,32223 Walton Parkway,Condong,644,10,336321,2020-05-20 13:07:57
408,feugiat non pretium,4150 Jana Park,El Mirador,248,9,442869,2020-07-21 18:59:27
409,et eros vestibulum ac est,6391 Redwing Center,Ingeniero Guillermo N. Juárez,1572,2,157920,2020-05-29 08:42:15
410,orci luctus et ultrices posuere cubilia curae,727 Kingsford Way,Tajimi,1314,6,556140,2021-03-26 19:00:17
411,lectus pellentesque at nulla,3 Sherman Alley,Ekerö,1261,3,797854,2021-05-11 21:00:42
412,libero ut massa volutpat,2 Aberg Way,Muro,826,6,936257,2020-09-19 11:03:33
413,sed magna at nunc commodo placerat,5 Dryden Circle,Tayum,235,7,893679,2020-07-31 13:47:39
414,mauris lacinia sapien quis libero nullam sit amet,1 Crownhardt Avenue,Chambéry,1396,1,801901,2021-03-15 04:47:27
415,nulla integer pede justo lacinia,58 Michigan Park,Juigalpa,1730,3,953448,2020-08-16 07:40:07
416,nascetur ridiculus mus etiam vel,51 Summer Ridge Pass,São José,477,3,718457,2020-09-02 20:55:23
417,cubilia curae nulla dapibus dolor,44443 Bonner Trail,Sangiang,1845,2,877167,2020-10-16 20:55:38
418,phasellus sit amet erat nulla tempus vivamus in,89 Nancy Alley,Blama,1459,10,169513,2020-07-11 03:41:48
419,sapien urna pretium nisl ut volutpat sapien arcu,9 Walton Avenue,Karabanovo,1353,1,505187,2020-06-10 21:39:46
420,pede malesuada in imperdiet,74335 Dovetail Trail,Graz,600,4,189165,2020-12-19 04:15:02
421,ut suscipit a,10 Emmet Circle,Xiaping,934,6,625219,2020-08-02 21:41:34
422,integer aliquet massa id lobortis convallis tortor risus,81154 Menomonie Terrace,Nevinnomyssk,386,9,722346,2021-01-05 16:27:02
423,fusce lacus purus aliquet at feugiat non pretium,90 Canary Road,Jelisavac,824,8,746566,2021-05-04 19:51:13
424,consequat lectus in est risus auctor sed tristique,8914 Di Loreto Plaza,San Juan de Limay,1590,7,808535,2020-10-16 03:43:33
425,sodales scelerisque mauris sit amet eros suspendisse accumsan,3 Delladonna Hill,General Pico,303,8,896292,2020-09-25 01:12:03
426,eu interdum eu tincidunt in leo maecenas,01150 Golf Terrace,Sukasetia,1874,8,554174,2020-09-23 17:49:42
427,amet erat nulla tempus vivamus in felis eu,02 Village Green Road,Zhangzhu,523,10,452810,2020-10-28 00:13:31
428,sit amet sem fusce consequat nulla nisl,41923 Butternut Pass,Vratsa,899,10,823572,2020-12-08 17:42:45
429,cras mi pede malesuada,36 Birchwood Crossing,Requião,421,6,285657,2020-10-03 01:05:44
430,sed accumsan felis ut at,11 Huxley Drive,Bangassou,641,10,588094,2021-04-13 23:10:10
431,justo aliquam quis turpis eget elit sodales,52671 Pearson Junction,Pan de Azúcar,1398,9,460711,2020-11-26 11:59:00
432,fermentum donec ut,17240 Grasskamp Pass,Ucluelet,1763,3,294786,2020-12-27 21:29:57
433,accumsan tellus nisi eu orci mauris lacinia,21 Hazelcrest Trail,Myrzakent,621,8,282968,2021-03-25 03:08:12
434,imperdiet et commodo vulputate justo in blandit,43956 Grasskamp Parkway,Masipi West,768,7,736883,2021-03-03 02:38:51
435,leo odio condimentum id luctus nec molestie,4 Delladonna Lane,Vyaz’ma,1500,10,304703,2020-08-23 20:17:01
436,convallis nulla neque libero convallis eget eleifend,84356 Marcy Way,Kawage,415,3,736058,2021-04-12 15:18:52
437,risus praesent lectus vestibulum quam sapien,85478 Arrowood Parkway,El Marañón,997,3,222278,2020-07-15 19:36:03
438,donec pharetra magna vestibulum aliquet,970 Sherman Road,Suizhong,495,6,142733,2020-08-09 23:15:23
439,sit amet lobortis sapien sapien non mi integer,33097 Doe Crossing Junction,Chambly,1866,2,771045,2020-12-17 06:48:21
440,eget vulputate ut ultrices vel augue,83 North Street,Cennan,1884,1,996443,2021-04-16 18:11:25
441,justo lacinia eget tincidunt eget tempus,9511 Buhler Street,Xiashuitou,37,7,441741,2020-09-03 14:02:33
442,mattis nibh ligula nec sem,90 Morningstar Pass,Dianfang,1616,1,488440,2020-06-03 01:52:13
443,in blandit ultrices enim lorem ipsum,67121 Scofield Street,Masaraway,941,7,577428,2020-06-14 03:55:19
444,quam sapien varius ut blandit,61 Pleasure Junction,Siedliska,24,10,66817,2021-02-09 07:26:44
445,ut odio cras mi pede malesuada in imperdiet,9720 Lindbergh Lane,Bulihan,1866,9,219917,2020-05-25 23:03:12
446,elit proin interdum mauris,87219 Clemons Trail,San Agustin,1651,8,638621,2021-01-23 01:59:20
447,leo rhoncus sed vestibulum,77 Hoepker Drive,Garcia Hernandez,850,1,455576,2020-10-29 05:28:44
448,fusce congue diam id ornare,434 Rowland Drive,Eskilstuna,34,1,620071,2020-06-24 12:19:13
449,vivamus vestibulum sagittis sapien cum sociis,5492 New Castle Crossing,Khurriānwāla,1980,9,39324,2020-11-21 00:06:01
450,habitasse platea dictumst aliquam augue quam sollicitudin,29 Luster Point,Habo,1751,9,446234,2020-06-25 10:49:03
451,sed justo pellentesque viverra pede ac,2 Dayton Circle,Żarów,217,4,883462,2020-07-08 01:31:12
452,amet cursus id turpis,70 Manitowish Place,Protección,1493,6,237099,2020-06-29 11:20:13
453,nulla eget eros elementum pellentesque quisque porta,29320 Ruskin Parkway,Riga,24,3,791785,2020-10-17 13:13:51
454,faucibus orci luctus et ultrices posuere cubilia,15717 Declaration Court,Jistebnice,1028,5,21592,2020-08-06 09:50:47
455,erat curabitur gravida,78 Bay Alley,Rawaapu,1331,6,993103,2020-09-25 14:13:09
456,vel augue vestibulum ante,796 Bunker Hill Street,Shahe,1491,2,704745,2021-04-03 22:54:18
457,penatibus et magnis dis parturient,3 Crest Line Way,Ibabang Tayuman,484,5,344417,2020-10-21 05:11:51
458,potenti cras in purus eu magna vulputate luctus,20882 Helena Pass,Jāti,430,5,275597,2020-12-07 01:15:36
459,sapien dignissim vestibulum vestibulum,0 Atwood Crossing,Selajambe Satu,82,4,586903,2021-01-23 04:54:28
460,fusce consequat nulla nisl nunc nisl,395 Ridgeway Place,Narsaq,567,10,352655,2021-01-09 21:38:55
461,semper rutrum nulla nunc,502 Bluejay Drive,Reims,592,2,34706,2020-10-17 02:30:36
462,pellentesque ultrices phasellus id sapien in sapien iaculis,7 Heath Plaza,Anh Son,315,2,88044,2020-11-24 03:36:23
463,natoque penatibus et magnis dis parturient montes nascetur,14426 Memorial Hill,Mizhhir’ya,1153,9,323274,2021-01-10 14:55:22
464,potenti cras in,134 Old Gate Way,Bromma,820,5,948314,2021-04-09 08:13:12
465,curae nulla dapibus dolor,98 Jackson Center,Changqing,1951,1,129743,2020-11-25 03:30:23
466,est quam pharetra magna ac consequat metus sapien,45845 Myrtle Way,Songhae,246,7,942547,2021-05-19 14:41:09
467,vel est donec odio justo,00818 Maple Wood Drive,Hagerstown,236,10,563166,2020-11-14 16:34:06
468,auctor gravida sem praesent id massa id nisl,23753 Carpenter Junction,Kalibaru,1274,5,646803,2021-05-01 00:18:03
469,in lectus pellentesque at nulla,1133 Sauthoff Pass,Lota,1735,2,915508,2020-09-11 20:51:55
470,cras non velit nec nisi vulputate,7 Rutledge Drive,Georgiyevskaya,1095,7,390998,2020-09-28 11:32:12
471,dapibus augue vel accumsan tellus nisi eu orci,57291 Warbler Pass,Tayirove,1795,3,864803,2021-04-30 19:13:22
472,odio elementum eu interdum,886 Gale Junction,Syevyerodonets’k,590,4,9165,2020-11-06 23:25:45
473,ullamcorper purus sit amet nulla quisque,920 Manitowish Hill,Strelitsa,532,2,283819,2020-08-19 11:24:41
474,pellentesque volutpat dui maecenas tristique est,4921 Dottie Point,Nuyno,261,10,336646,2020-11-16 22:14:50
475,erat nulla tempus vivamus,88 Buena Vista Circle,Vahdat,952,2,570079,2020-07-02 10:44:40
476,risus praesent lectus vestibulum quam sapien varius ut,0076 Menomonie Street,Hushan,1581,7,668424,2020-08-22 22:53:15
477,pellentesque at nulla,324 Michigan Crossing,Shitang,232,4,631858,2020-12-27 21:00:51
478,maecenas pulvinar lobortis est phasellus sit amet,4746 Ramsey Terrace,Neochórion,828,8,647820,2020-11-25 03:23:28
479,neque sapien placerat ante,91 Acker Plaza,Yuty,869,1,657358,2021-01-02 08:02:08
480,magnis dis parturient,5246 Dunning Road,Alès,1064,2,374599,2020-09-18 01:04:31
481,lacus at turpis donec posuere,9 Carioca Parkway,Vilhena,1990,10,209299,2021-03-23 18:01:17
482,lectus in est risus auctor sed tristique in,1579 Sugar Pass,Hushi,561,7,496247,2020-06-12 04:11:43
483,consequat lectus in est risus,5489 Sage Parkway,Drachten,236,6,276165,2020-10-30 20:02:16
484,nam dui proin leo odio porttitor id,3592 Sherman Parkway,Pomacocha,809,7,233770,2020-11-11 04:55:14
485,ipsum primis in faucibus orci,3 Emmet Crossing,Huxi,445,5,983274,2020-12-26 15:40:31
486,interdum mauris ullamcorper purus sit amet nulla quisque,84 Sage Hill,Žrnovnica,1390,8,519223,2020-11-03 08:26:32
487,aliquet massa id lobortis,6645 Bellgrove Way,Pisaras,1854,2,815395,2021-03-17 10:35:05
488,suspendisse accumsan tortor quis turpis sed ante,404 Susan Place,Portela,1707,3,372860,2020-05-21 18:58:43
489,felis fusce posuere felis sed lacus morbi,6214 Tomscot Crossing,Nelson,118,9,587652,2021-01-31 00:19:52
490,id sapien in sapien iaculis congue vivamus,320 Tennyson Road,Taodian,1566,2,425776,2021-02-12 08:44:38
491,nec condimentum neque sapien placerat ante,70 Dryden Parkway,Progreso,1665,3,139019,2020-10-23 17:09:45
492,et ultrices posuere cubilia curae nulla dapibus,61620 Melvin Point,Jiancheng,1137,4,365154,2020-07-14 19:48:59
493,metus aenean fermentum donec ut,47574 Green Drive,Mirontsi,1338,6,80474,2020-09-09 02:17:54
494,vulputate vitae nisl aenean lectus pellentesque eget nunc,536 Meadow Valley Terrace,Al Mughayyir,21,5,424113,2021-05-01 15:49:15
495,duis faucibus accumsan odio curabitur,4 Texas Center,Kaum,625,4,493096,2020-10-21 04:39:34
496,elementum in hac habitasse platea,37 Welch Lane,Jega,1357,5,809860,2020-11-01 19:22:28
497,faucibus orci luctus et ultrices posuere cubilia curae,2 Park Meadow Crossing,Mhamid,540,2,810504,2020-06-20 02:43:13
498,luctus tincidunt nulla,60 Vidon Crossing,Haitang,37,7,584545,2020-09-12 23:35:51
499,in felis eu sapien cursus vestibulum proin,7 Fairfield Pass,Hostavice,855,7,586464,2021-01-21 12:41:51
500,proin eu mi nulla ac enim in,99 Moland Street,Floresta,519,8,396380,2020-05-24 09:05:58
501,integer ac neque duis bibendum morbi non quam,0 Dahle Trail,Nampicuan,43,4,919827,2020-11-26 19:05:11
502,augue aliquam erat volutpat in congue,0319 Stoughton Way,Chãos,425,9,127089,2021-02-16 22:50:28
503,odio consequat varius integer,575 Superior Junction,Cambanay,1476,9,963042,2020-06-08 04:03:55
504,dolor vel est donec odio justo sollicitudin ut,521 Brentwood Road,Agrelo,570,6,828192,2020-10-21 18:40:39
505,sed vel enim sit amet nunc,54 Evergreen Parkway,Costa Sacate,939,8,791826,2020-10-13 20:41:20
